Symbol,Name,Last Sale,Net Change,% Change,Market Cap,Country,IPO Year,Volume,Sector,Industry
RCI,Rogers Communication Inc. Common Stock,$53.12,-0.66,-1.227%,26821632892.00,Canada,,84625,,
RCL,D/B/A Royal Caribbean Cruises Ltd. Common Stock,$82.7199,-3.3201,-3.859%,21058059290.00,United States,1993,2796349,,
RCS,PIMCO Strategic Income Fund Inc.,$7.71,-0.07,-0.90%,341791054.00,United States,1994,36408,Finance,Investment Managers
RCUS,Arcus Biosciences Inc. Common Stock,$28.09,0.78,2.856%,1994273707.00,,2018,203197,Health Care,Major Pharmaceuticals
RDN,Radian Group Inc. Common Stock,$22.04,-0.50,-2.218%,4216616916.00,United States,,348835,Finance,Property-Casualty Insurers
RDS/B,Royal Dutch Shell PLC,$38.95,-0.76,-1.914%,,Netherlands,,2952420,,
RDY,Dr. Reddy's Laboratories Ltd Common Stock,$74.13,-1.16,-1.541%,12289637083.00,India,,29579,Health Care,Major Pharmaceuticals
RE,Everest Re Group Ltd. Common Stock,$248.80,-3.55,-1.407%,9972781020.00,Bermuda,,268267,Finance,Property-Casualty Insurers
RELX,RELX PLC PLC American Depositary Shares (Each representing One Ordinary Share),$27.575,0.175,0.639%,53310936968.00,United Kingdom,2015,280262,Consumer Services,Publishing
RENN,Renren Inc. American Depositary Shares each representing fifteen Class A ordinary shares,$11.67,0.03,0.258%,280305885.00,China,2011,19242,Technology,EDP Services
RERE,AiHuiShou International Co. Ltd. American Depositary Shares (every three of which representing two Class A ordinary shares),$14.23,-0.68,-4.561%,3168093716.00,,2021,156381,,
RES,RPC Inc. Common Stock,$4.845,-0.325,-6.286%,1045236191.00,United States,,419193,Energy,Oilfield Services/Equipment
REV,Revlon Inc. New Common Stock,$12.53,0.06,0.481%,670184241.00,United States,1996,77955,Consumer Non-Durables,Package Goods/Cosmetics
REVG,REV Group Inc. Common Stock,$15.4639,-0.2861,-1.817%,1001162206.00,United States,2017,137971,Capital Goods,Industrial Machinery/Components
REX,REX American Resources Corporation,$81.095,-5.165,-5.988%,485921240.00,United States,,4098,Basic Industries,Automotive Aftermarket
REXR,Rexford Industrial Realty Inc. Common Stock,$57.44,0.00,0.00%,7700541327.00,United States,2013,155489,Consumer Services,Real Estate Investment Trusts
REXR^A,Rexford Industrial Realty Inc. 5.875% Series A Cumulative Redeemable Preferred Stock,$25.2558,-0.0142,-0.056%,,United States,,2067,,
REXR^B,Rexford Industrial Realty Inc. 5.875% Series B Cumulative Redeemable Preferred Stock,$26.80,0.00,0.00%,,United States,,58,,
REXR^C,Rexford Industrial Realty Inc. 5.625% Series C Cumulative Redeemable Preferred Stock par value $0.01 per share,$27.58,0.03,0.109%,,United States,,10831,,
REZI,Resideo Technologies Inc. Common Stock ,$28.92,-1.01,-3.375%,4160153366.00,,2018,337588,Miscellaneous,Diversified Manufacture
RF,Regions Financial Corporation Common Stock,$19.615,-0.645,-3.184%,18855613043.00,United States,,3560301,Finance,Major Banks
RF^B,Regions Financial Corporation Depositary Shares Representing 1/40th Perpetual Preferred Series B,$29.0539,0.1139,0.394%,,United States,,10267,,
RF^C,Regions Financial Corporation Depositary Shares each Representing a 1/40th Interest in a  Share of 5.700% Fixed-to-Floating Rate Non-Cumulative  Perpetual Preferred Stock Series C,$29.5866,0.0766,0.26%,,United States,,11728,,
RF^E,Regions Financial Corporation Depositary Shares Each Representing a 1/40th Interest in a Share of 4.45% Non-Cumulative Perpetual Preferred Stock Series E,$25.6574,0.0474,0.185%,,United States,,24481,,
RFI,Cohen & Steers Total Return Realty Fund Inc. Common Stock,$16.322,-0.058,-0.354%,428462277.00,United States,1993,20311,Finance,Investment Managers
RFL,Rafael Holdings Inc. Class B Common Stock,$63.22,3.21,5.349%,1119909489.00,United States,2018,94173,Health Care,Major Pharmaceuticals
RFM,RiverNorth Flexible Municipal Income Fund Inc. Common Stock,$23.97,0.09,0.377%,146569335.00,,2020,10257,Finance,Trusts Except Educational Religious and Charitable
RFMZ,RiverNorth Flexible Municipal Income Fund II Inc. Common Stock,$20.655,-0.025,-0.121%,0.00,,2021,19361,Finance,Trusts Except Educational Religious and Charitable
RFP,Resolute Forest Products Inc. Common Stock,$11.4364,-0.6736,-5.562%,904517650.00,Canada,,323823,Basic Industries,Paper
RGA,Reinsurance Group of America Incorporated Common Stock,$113.335,-1.545,-1.345%,7705107515.00,United States,,161708,Finance,Life Insurance
RGR,Sturm Ruger & Company Inc. Common Stock,$82.36,-1.06,-1.271%,1448185296.00,United States,,127512,,
RGS,Regis Corporation Common Stock,$9.0122,-0.3978,-4.227%,322545016.00,United States,1991,54592,,
RGT,Royce Global Value Trust Inc. Common Stock,$15.09,-0.05,-0.33%,84515936.00,,2013,6573,Finance,Trusts Except Educational Religious and Charitable
RH,RH Common Stock,$679.25,-10.63,-1.541%,14284881540.00,United States,2012,203321,Consumer Services,Other Specialty Stores
RHI,Robert Half International Inc. Common Stock,$85.53,-3.14,-3.541%,9646124034.00,United States,,454892,Technology,Diversified Commercial Services
RHP,Ryman Hospitality Properties Inc. (REIT),$72.98,-3.88,-5.048%,4018634140.00,United States,,194631,Consumer Services,Real Estate Investment Trusts
RICE,Rice Acquisition Corp. Class A Common Stock,$17.65,-0.15,-0.843%,523478703.00,United States,2020,19955,,
RIG,Transocean Ltd (Switzerland) Common Stock,$4.665,-0.415,-8.169%,2879699625.00,Switzerland,,31845201,Energy,Oil & Gas Production
RIO,Rio Tinto Plc Common Stock,$82.04,-1.59,-1.901%,132822067911.00,Australia,2002,898382,Basic Industries,Steel/Iron Ore
RIV,RiverNorth Opportunities Fund Inc. Common Stock,$18.50,-0.14,-0.751%,187906350.00,,2015,116562,Finance,Finance Companies
RJF,Raymond James Financial Inc. Common Stock,$129.925,-1.715,-1.303%,17854047422.00,United States,,115310,Finance,Investment Bankers/Brokers/Service
RKT,Rocket Companies Inc. Class A Common Stock,$18.68,-0.07,-0.373%,2549333797.00,United States,2020,2494230,Finance,Finance: Consumer Services
RKTA,Rocket Internet Growth Opportunities Corp. Class A Ordinary Shares,$9.655,-0.035,-0.361%,322235625.00,,2021,891,,
RL,Ralph Lauren Corporation Common Stock,$113.91,-3.88,-3.294%,8371791301.00,United States,1997,324441,Consumer Non-Durables,Department/Specialty Retail Stores
RLGY,Realogy Holdings Corp. Common Stock,$17.985,-0.765,-4.08%,2093891539.00,United States,2012,813641,Finance,Real Estate
RLI,RLI Corp. Common Stock (DE),$103.52,-2.67,-2.514%,4679459902.00,United States,,47328,Finance,Property-Casualty Insurers
RLJ,RLJ Lodging Trust Common Shares of Beneficial Interest $0.01 par value,$14.42,-0.66,-4.377%,2378113955.00,United States,2011,242654,Consumer Services,Real Estate Investment Trusts
RLJ^A,RLJ Lodging Trust $1.95 Series A Cumulative Convertible  Preferred Shares,$28.36,-0.30,-1.047%,,United States,,21709,,
RLX,RLX Technology Inc. American Depositary Shares each representing the right to receive one (1) Class A ordinary share,$8.05,-0.38,-4.508%,12644864089.00,,2021,3308283,Consumer Non-Durables,Farming/Seeds/Milling
RM,Regional Management Corp. Common Stock,$45.39,-0.95,-2.05%,482354809.00,United States,2012,23319,Finance,Finance: Consumer Services
RMAX,RE/MAX Holdings Inc. Class A Common Stock,$32.75,-0.65,-1.946%,1029994116.00,,2013,43377,Finance,Real Estate
RMD,ResMed Inc. Common Stock,$246.485,-4.045,-1.615%,35867962821.00,United States,,377680,Health Care,Medical/Dental Instruments
RMI,RiverNorth Opportunistic Municipal Income Fund Inc. Common Stock,$23.50,-0.1757,-0.742%,149771798.00,,2018,3594,Finance,Finance/Investors Services
RMM,RiverNorth Managed Duration Municipal Income Fund Inc. Common Stock,$20.475,-0.045,-0.219%,404166611.00,,2019,45096,Finance,Trusts Except Educational Religious and Charitable
RMO,Romeo Power Inc. Class A Common Stock,$7.555,-0.195,-2.516%,991195979.00,,2019,1846711,Capital Goods,Automotive Aftermarket
RMPL^,RiverNorth Specialty Finance Corporation 5.875% ,$25.4394,-0.0351,-0.138%,,,,1901,,
RMT,Royce Micro-Cap Trust Inc. Common Stock,$12.22,-0.17,-1.372%,534805709.00,United States,,50804,Finance,Investment Managers
RNG,RingCentral Inc. Class A Common Stock,$298.475,8.915,3.079%,27123321660.00,,2013,418825,Technology,EDP Services
RNGR,Ranger Energy Services Inc. Class A Common Stock,$8.2977,0.0677,0.823%,141036306.00,United States,2017,5004,Energy,Oilfield Services/Equipment
RNP,Cohen & Steers REIT and Preferred and Income Fund Inc. Common Shares,$27.1718,0.0418,0.154%,1292893832.00,United States,2003,53653,Finance,Investment Managers
RNR,RenaissanceRe Holdings Ltd. Common Stock,$148.75,-0.09,-0.06%,7383610255.00,Bermuda,,149102,Finance,Property-Casualty Insurers
RNR^E,RenaissanceRe Holdings Ltd. 5.375% Series E Preference Shares,$25.2966,0.0166,0.066%,,Bermuda,,17497,,
RNR^F,RenaissanceRe Holdings Ltd. Depositary Shares each Representing a 1/1000th Interest in a 5.750% Series F Preference Share,$27.2182,0.1882,0.696%,,Bermuda,,4297,,
ROG,Rogers Corporation Common Stock,$196.85,-1.67,-0.841%,3683487515.00,United States,,26138,Capital Goods,Industrial Machinery/Components
ROK,Rockwell Automation Inc. Common Stock,$281.58,-3.65,-1.28%,32684875778.00,United States,,214817,Capital Goods,Industrial Machinery/Components
ROL,Rollins Inc. Common Stock,$34.60,-0.06,-0.173%,17027473654.00,United States,,241672,Technology,Industrial Specialties
ROP,Roper Technologies Inc. Common Stock,$473.035,0.435,0.092%,49781743610.00,United States,1992,127892,Capital Goods,Industrial Machinery/Components
ROSS,Ross Acquisition Corp II Class A Ordinary Shares,$9.72,0.02,0.206%,419175000.00,,2021,9862,,
ROT,Rotor Acquisition Corp. Class A Common Stock,$9.935,0.005,0.05%,342757500.00,,2021,14686,,
RPAI,Retail Properties of America Inc. Class A Common Stock,$11.32,-0.23,-1.991%,2430772557.00,United States,2012,620191,Consumer Services,Real Estate Investment Trusts
RPM,RPM International Inc. Common Stock,$89.03,-1.19,-1.319%,11530394066.00,United States,,126443,Basic Industries,Paints/Coatings
RPT,RPT Realty Common Stock,$12.80,-0.32,-2.439%,1038912422.00,United States,,78638,Consumer Services,Real Estate Investment Trusts
RPT^D,RPT Realty 7.25% ,$56.2187,-0.7913,-1.388%,,United States,,5275,,
RQI,Cohen & Steers Quality Income Realty Fund Inc Common Shares,$15.8918,-0.1482,-0.924%,2133366547.00,United States,2002,160272,Finance,Trusts Except Educational Religious and Charitable
RRC,Range Resources Corporation Common Stock,$15.555,-0.745,-4.571%,3882385376.00,United States,,1702068,Energy,Oil & Gas Production
RRD,R.R. Donnelley & Sons Company Common Stock,$6.29,-0.38,-5.697%,454138000.00,United States,,305556,Consumer Services,Recreational Products/Toys
RS,Reliance Steel & Aluminum Co. Common Stock (DE),$148.73,-3.71,-2.434%,9475267341.00,United States,1994,120796,Basic Industries,Steel/Iron Ore
RSF,RiverNorth Specialty Finance Corporation,$19.8565,0.0165,0.083%,102610430.00,,2019,10798,Finance,Investment Managers
RSG,Republic Services Inc. Common Stock,$111.825,0.415,0.372%,35675911185.00,United States,1998,599219,Public Utilities,Environmental Services
RSI,Rush Street Interactive Inc. Class A Common Stock,$11.86,-0.30,-2.467%,2599230057.00,,2020,507143,Consumer Services,Services-Misc. Amusement & Recreation
RTP,Reinvent Technology Partners Class A Ordinary Shares,$9.99,-0.01,-0.10%,861637500.00,United States,2020,199056,Finance,Business Services
RTPZ,Reinvent Technology Partners Z Class A Ordinary Shares,$9.94,-0.01,-0.101%,285775000.00,United States,2021,24404,Finance,Business Services
RTX,Raytheon Technologies Corporation Common Stock,$85.235,-1.465,-1.69%,129138685069.00,United States,,1870827,Capital Goods,Aerospace
RVI,Retail Value Inc. Common Stock ,$21.7682,-0.2318,-1.054%,458944446.00,United States,2018,46048,Consumer Services,Real Estate Investment Trusts
RVLV,Revolve Group Inc. Class A Common Stock,$69.37,-3.03,-4.185%,5008958454.00,,2019,450880,Consumer Services,Catalog/Specialty Distribution
RVT,Royce Value Trust Inc. Common Stock,$18.64,-0.39,-2.049%,1900771072.00,United States,1986,89164,Finance,Trusts Except Educational Religious and Charitable
RWT,Redwood Trust Inc. Common Stock,$11.85,-0.13,-1.085%,1339174389.00,United States,1995,559647,Consumer Services,Real Estate Investment Trusts
RXN,Rexnord Corporation Common Stock,$49.90,-0.90,-1.772%,5974080894.00,United States,2012,106954,Technology,Industrial Machinery/Components
RY,Royal Bank Of Canada Common Stock,$100.83,-1.38,-1.35%,143692469306.00,Canada,,354352,,
RY^T,Royal Bank Of Canada 6.750% Fixed Rate/Floating Rate Noncumulative First Preferred Shares Series C-2,$29.50,-0.50,-1.667%,,Canada,,1356,,
RYAM,Rayonier Advanced Materials Inc. Common Stock,$6.82,0.14,2.096%,433733947.00,United States,2014,216455,Basic Industries,Industrial Specialties
RYB,RYB Education Inc. American depositary shares each representing one Class A ordinary share,$4.27,-0.10,-2.288%,117793697.00,,2017,37063,Miscellaneous,Other Consumer Services
RYI,Ryerson Holding Corporation Common Stock,$13.705,-0.715,-4.958%,527294311.00,United States,2014,37723,Capital Goods,Office Equipment/Supplies/Services
RYN,Rayonier Inc. REIT Common Stock,$36.65,0.00,0.00%,5095447338.00,United States,,512425,Consumer Services,Real Estate Investment Trusts
RZA,Reinsurance Group of America Incorporated 6.20% Fixed-to-Floating Rate Subordinated Debentures due 2042,$27.1708,0.0008,0.003%,0.00,United States,,13573,Finance,Life Insurance
RZB,Reinsurance Group of America Incorporated 5.75% Fixed-To-Floating Rate Subordinated Debentures due 2056,$28.5101,-0.1299,-0.454%,0.00,United States,2016,8523,Finance,Life Insurance
S,SentinelOne Inc. Class A Common Stock,$49.12,4.53,10.159%,0.00,,2021,4833028,,
SA,Seabridge Gold Inc. Ordinary Shares (Canada),$17.555,-0.115,-0.651%,1324336350.00,Canada,,129962,Basic Industries,Precious Metals
SAF,Saratoga Investment Corp 6.25% Notes due 2023,$25.47,0.055,0.216%,0.00,United States,2018,1226,Finance,Finance Companies
SAFE,Safehold Inc. Common Stock,$80.552,1.032,1.298%,4290426677.00,United States,2017,42722,Consumer Services,Real Estate
SAH,Sonic Automotive Inc. Common Stock,$44.19,-2.52,-5.395%,1838073240.00,United States,1997,115343,Consumer Services,Other Specialty Stores
SAIC,SCIENCE APPLICATIONS INTERNATIONAL CORPORATION Common Stock,$86.12,-1.17,-1.34%,4991445271.00,,,115257,Technology,EDP Services
SAIL,SailPoint Technologies Holdings Inc. Common Stock,$50.87,0.65,1.294%,4678041318.00,United States,2017,389139,Technology,Computer Software: Prepackaged Software
SAK,Saratoga Investment Corp 7.25% Notes due 2025,$26.32,0.00,0.00%,0.00,United States,2020,850,Finance,Finance Companies
SAM,Boston Beer Company Inc. (The) Common Stock,$932.755,-21.095,-2.212%,11460550815.00,United States,,115344,Consumer Non-Durables,Beverages (Production/Distribution)
SAN,Banco Santander S.A. Sponsored ADR (Spain),$3.765,-0.095,-2.461%,65181663101.00,Spain,,3315251,Finance,Commercial Banks
SAND          ,Sandstorm Gold Ltd. Ordinary Shares (Canada),$7.81,-0.15,-1.884%,1519591310.00,Canada,,1053880,Basic Industries,Precious Metals
SAP,SAP  SE ADS,$141.15,-0.57,-0.402%,166497623841.00,Germany,,220493,Technology,Computer Software: Prepackaged Software
SAR,Saratoga Investment Corp New,$27.18,0.08,0.295%,303328664.00,United States,,27288,Finance,Finance Companies
SAVE,Spirit Airlines Inc. Common Stock,$30.16,-0.80,-2.584%,3269399796.00,United States,,1346647,Transportation,Air Freight/Delivery Services
SB,Safe Bulkers Inc Common Stock ($0.001 par value),$3.69,-0.05,-1.337%,401747053.00,Monaco,2008,699333,Transportation,Marine Transportation
SB^C,Safe Bulkers Inc Cumulative Redeemable Perpetual Preferred Series C (Marshall Islands),$25.5001,-0.0899,-0.351%,,Monaco,,4428,,
SB^D,Safe Bulkers Inc Perpetual Preferred Series D (Marshall Islands),$25.53,-0.02,-0.078%,,Monaco,,4161,,
SBBA,Scorpio Tankers Inc. 7.00% Senior Notes due 2025,$25.05,0.05,0.20%,0.00,Monaco,2020,6336,Transportation,Marine Transportation
SBG,Sandbridge Acquisition Corporation Class A Common Stock,$9.97,0.00,0.00%,286637500.00,,2020,700678,,
SBH,Sally Beauty Holdings Inc. (Name to be changed from Sally Holdings Inc.) Common Stock,$21.52,-0.63,-2.844%,2430769413.00,United States,,475256,Miscellaneous,Diversified Commercial Services
SBI,Western Asset Intermediate Muni Fund Inc Common Stock,$9.84,0.09,0.923%,138569980.00,United States,1992,3435,Finance,Finance/Investors Services
SBII,Sandbridge X2 Corp. Class A Common Stock,$9.65,-0.05,-0.515%,287301016.00,,2021,100,Finance,Business Services
SBOW,SilverBow Resorces Inc. Common Stock,$23.90,-0.44,-1.808%,291496302.00,,,112227,Energy,Oil & Gas Production
SBR,Sabine Royalty Trust Common Stock,$40.40,-0.57,-1.391%,589005538.00,United States,,16547,Energy,Oil & Gas Production
SBS,Companhia de saneamento Basico Do Estado De Sao Paulo - Sabesp American Depositary Shares (Each repstg 250 Common Shares),$6.895,-0.355,-4.897%,4712800547.00,Brazil,2002,659814,Public Utilities,Water Supply
SBSW,D/B/A Sibanye-Stillwater Limited ADS,$16.4275,-0.4025,-2.392%,12125898425.00,,,1457450,Basic Industries,Precious Metals
SC,Santander Consumer USA Holdings Inc. Common Stock,$40.10,-0.46,-1.134%,12272032974.00,,2014,1988891,Finance,Finance Companies
SCCO,Southern Copper Corporation Common Stock,$61.96,-2.23,-3.474%,47899619747.00,United States,,625971,Basic Industries,Precious Metals
SCD,LMP Capital and Income Fund Inc. Common Stock,$14.47,-0.145,-0.992%,259902948.00,United States,2004,58338,Finance,Trusts Except Educational Religious and Charitable
SCE^G,SCE Trust II Trust Preferred Securities,$25.0477,-0.0123,-0.049%,,United States,,13895,,
SCE^H,SCE Trust III Fixed/Floating Rate Trust Preference Securities,$25.425,0.125,0.494%,,United States,,11510,,
SCE^J,Southern California Edison Company 5.375% Fixed-to-Floating Rate Trust Preference Securities,$25.10,0.01,0.04%,,United States,,12567,,
SCE^K,Southern California Edison Company 5.45% Fixed-to-Floating Rate Trust Preference Securities,$25.04,0.00,0.00%,,United States,,23495,,
SCE^L,SCE TRUST VI,$24.9498,-0.0002,-0.001%,,United States,,4921,,
SCHW,Charles Schwab Corporation (The) Common Stock,$70.935,-1.865,-2.562%,133807977202.00,United States,,3296483,Finance,Investment Bankers/Brokers/Service
SCHW^D,The Charles Schwab Corporation Depositary Shares each representing 1/40th interest in a share of 5.95% Non-Cumulative Perpetual Preferred Stock Series D,$25.38,0.02,0.079%,,United States,,20580,,
SCHW^J,The Charles Schwab Corporation Depositary Shares Each Representing a 1/40th Interest in a Share of 4.450% Non-Cumulative Perpetual Preferred Stock Series J,$26.6434,-0.1066,-0.399%,,United States,,44683,,
SCI,Service Corporation International Common Stock,$53.96,-0.52,-0.954%,9072908433.00,United States,,603283,Miscellaneous,Other Consumer Services
SCL,Stepan Company Common Stock,$119.05,-2.85,-2.338%,2680640874.00,United States,,19258,Consumer Non-Durables,Package Goods/Cosmetics
SCM,Stellus Capital Investment Corporation Common Stock,$12.8361,-0.0739,-0.572%,250124283.00,United States,2012,29636,Finance,Finance/Investors Services
SCPE,SC Health Corporation Class A Ordinary Shares,$10.08,0.00,0.00%,229950000.00,,2019,9608,Finance,Business Services
SCS,Steelcase Inc. Common Stock,$14.51,-0.19,-1.293%,1678516104.00,United States,1998,223081,Consumer Durables,Office Equipment/Supplies/Services
SCU,Sculptor Capital Management Inc. Class A Common Stock,$24.3243,-0.3857,-1.561%,1404535433.00,United States,,53443,Finance,Investment Managers
SCVX,SCVX Corp. Class A Ordinary Shares,$9.8848,-0.0052,-0.053%,284188000.00,,2020,10618,Finance,Business Services
SCX,L.S. Starrett Company (The) Common Stock,$8.60,-0.35,-3.911%,61090564.00,United States,,7378,Consumer Durables,Home Furnishings
SD,SandRidge Energy Inc. Common Stock,$5.89,-0.37,-5.911%,215025682.00,,2016,261076,Energy,Oil & Gas Production
SDHY,PGIM Short Duration High Yield Opportunities Fund Common Shares,$19.535,-0.095,-0.484%,481988149.00,,2020,16926,Finance,Finance/Investors Services
SE,Sea Limited American Depositary Shares each representing one Class A Ordinary Share,$274.75,1.05,0.384%,144088104675.00,United States,2017,1184541,Technology,Computer Software: Prepackaged Software
SEAH,Sports Entertainment Acquisition Corp. Class A Common Stock,$10.07,0.01,0.099%,566437500.00,United States,2020,208523,,
SEAS,SeaWorld Entertainment Inc. Common Stock,$48.85,-2.24,-4.384%,3862187591.00,United States,2013,264143,Consumer Services,Movies/Entertainment
SEE,Sealed Air Corporation Common Stock,$58.05,-1.26,-2.124%,8823014450.00,United States,,370393,Basic Industries,Containers/Packaging
SEM,Select Medical Holdings Corporation Common Stock,$41.23,-1.41,-3.307%,5559399848.00,United States,2009,189730,Health Care,Hospital/Nursing Management
SEMR,SEMrush Holdings Inc. Class A Common Stock,$21.46,-1.12,-4.96%,2910517221.00,,2021,132294,Technology,EDP Services
SF,Stifel Financial Corporation Common Stock,$64.41,-0.77,-1.181%,6768864484.00,United States,,211510,Finance,Investment Bankers/Brokers/Service
SF^A,Stifel Financial Corporation Depositary Shares each representing a 1/1000th interest in a share of 6.25% Non-Cumulative Preferred Stock Series A,$25.88,0.06,0.232%,,United States,,3698,,
SF^B,Stifel Financial Corporation Depositary Shares Each Representing 1/1000th  Interest in a Share of 6.25% Non-Cumulative  Preferred Stock Series B,$27.541,0.00,0.00%,,United States,,410,,
SF^C,Stifel Financial Corporation Depositary Shares Each Representing 1/1000th Interest in a Share of 6.125% Non Cumulative Preferred Stock Series C,$28.08,0.02,0.071%,,United States,,3651,,
SFB,Stifel Financial Corporation 5.20% Senior Notes due 2047,$26.50,0.12,0.455%,0.00,United States,2017,2964,Finance,Investment Bankers/Brokers/Service
SFBS,ServisFirst Bancshares Inc. Common Stock,$64.95,-1.81,-2.711%,3517229686.00,United States,,85341,Finance,Major Banks
SFE,Safeguard Scientifics Inc. New Common Stock,$7.76,-0.11,-1.398%,162630759.00,United States,,82789,Finance,Finance/Investors Services
SFL,SFL Corporation Ltd,$7.59,-0.02,-0.263%,883166578.00,Bermuda,,392405,Transportation,Marine Transportation
SFTW,Osprey Technology Acquisition Corp. Class A Common Stock,$10.01,-0.03,-0.299%,395707813.00,,2019,1504055,,
SFUN,Fang Holdings Limited American Depositary Shares (Each representing Four Class A Ordinary Shares HK$1.00 par value),$11.7999,0.0199,0.169%,106260660.00,China,2010,4530,Technology,EDP Services
SGFY,Signify Health Inc. Class A Common Stock,$29.18,-0.59,-1.982%,6583750252.00,,2021,155582,Technology,Retail: Computer Software & Peripheral Equipment
SGU,Star Group L.P. Common Stock,$11.26,-0.06,-0.53%,452643352.00,United States,,24855,Public Utilities,Oil Refining/Marketing
SHAK,Shake Shack Inc. Class A Common Stock,$104.46,0.27,0.259%,4389952601.00,United States,2015,150291,Consumer Services,Restaurants
SHG,Shinhan Financial Group Co Ltd American Depositary Shares,$34.97,-0.65,-1.825%,18065264344.00,South Korea,,66908,Finance,Major Banks
SHI,SINOPEC Shangai Petrochemical Company Ltd. Common Stock,$23.015,-0.075,-0.325%,2491100677.00,China,,8842,Basic Industries,Major Chemicals
SHLX,Shell Midstream Partners L.P. Common Units representing Limited Partner Interests,$14.55,-0.36,-2.414%,5722362763.00,United States,2014,636718,Energy,Oilfield Services/Equipment
SHO,Sunstone Hotel Investors Inc. Sunstone Hotel Investors Inc. Common Shares,$11.97,-0.43,-3.468%,2588372786.00,United States,2004,488428,Consumer Services,Hotels/Resorts
SHO^F,Sunstone Hotel Investors Inc. 6.450% Series F Cumulative Redeemable Preferred Stock,$25.7493,-0.1307,-0.505%,,United States,,1200,,
SHO^H,Sunstone Hotel Investors Inc. 6.125% Series H Cumulative Redeemable Preferred Stock,$26.95,0.12,0.447%,,United States,,7800,,
SHOP,Shopify Inc. Class A Subordinate Voting Shares,$1500.87,36.12,2.466%,186682983367.00,Canada,2015,1214712,,
SHW,Sherwin-Williams Company (The) Common Stock,$272.9042,-2.3158,-0.841%,72578763101.00,United States,,236053,Basic Industries,Paints/Coatings
SI,Silvergate Capital Corporation Class A Common Stock,$105.90,-1.81,-1.68%,2788449299.00,United States,2019,154251,Finance,Major Banks
SID,Companhia Siderurgica Nacional S.A. Common Stock,$8.48,-0.44,-4.933%,11703371359.00,Brazil,,2245026,Basic Industries,Steel/Iron Ore
SIG,Signet Jewelers Limited Common Shares,$76.54,-2.48,-3.138%,4031139069.00,Bermuda,,283495,Consumer Services,Consumer Specialties
SII,Sprott Inc. Common Shares,$39.21,-0.01,-0.025%,977775339.00,,2020,34887,Finance,Investment Managers
SITC,SITE Centers Corp. Common Stock,$14.73,-0.19,-1.273%,3108488869.00,United States,,611609,Consumer Services,Real Estate Investment Trusts
SITC^A,SITE Centers Corp. 6.375% Class A Preferred Shares,$26.45,0.00,0.00%,,United States,,3052,,
SITE,SiteOne Landscape Supply Inc. Common Stock,$169.60,-0.67,-0.393%,7535019158.00,United States,2016,95575,,
SIX,Six Flags Entertainment Corporation New Common Stock,$42.16,-1.53,-3.502%,3600116897.00,United States,,425098,Consumer Services,Movies/Entertainment
SJI,South Jersey Industries Inc. Common Stock,$25.98,-0.30,-1.142%,2920707816.00,United States,,210798,Public Utilities,Oil/Gas Transmission
SJIJ,South Jersey Industries Inc. 5.625% Junior Subordinated Notes due 2079,$26.40,0.00,0.00%,0.00,United States,2019,5027,Public Utilities,Oil/Gas Transmission
SJIV,South Jersey Industries Inc. Corporate Units,$55.80,-0.42,-0.747%,0.00,United States,2021,4904,Public Utilities,Oil/Gas Transmission
SJM,J.M. Smucker Company (The) New Common Stock,$128.70,-0.99,-0.763%,13946163531.00,United States,,202210,Consumer Non-Durables,Packaged Foods
SJR,Shaw Communications Inc. Common Stock,$28.58,-0.42,-1.448%,14251626377.00,Canada,,78438,Consumer Services,Television Services
SJT,San Juan Basin Royalty Trust Common Stock,$4.99,0.01,0.201%,232577892.00,United States,,115330,Energy,Oil & Gas Production
