Symbol,Name,Last Sale,Net Change,% Change,Market Cap,Country,IPO Year,Volume,Sector,Industry
PPGH,Poema Global Holdings Corp. Class A Ordinary Share,$9.69,0.00,0.00%,417881250.00,China,2021,71,Finance,Business Services
PPGHU,Poema Global Holdings Corp. Unit,$10.05,-0.02,-0.199%,0.00,China,2021,265,Finance,Business Services
PPGHW,Poema Global Holdings Corp. Warrant,$0.801,0.001,0.125%,0.00,China,2021,1175,Finance,Business Services
PPIH,Perma-Pipe International Holdings Inc. Common Stock,$6.9098,0.1498,2.216%,56418441.00,United States,,1078,,
PPSI,Pioneer Power Solutions Inc. Common Stock,$4.85,-0.20,-3.96%,42321318.00,United States,,368806,Consumer Durables,Electrical Products
PPTA,Perpetua Resources Corp. Common Shares,$6.72,-0.73,-9.799%,369075222.00,Canada,,166393,,
PRAA,PRA Group Inc. Common Stock,$38.135,-0.265,-0.69%,1746577470.00,United States,2002,68312,Technology,Advertising
PRAX,Praxis Precision Medicines Inc. Common Stock,$19.03,0.24,1.277%,735785778.00,United States,2020,57359,Health Care,Major Pharmaceuticals
PRCH,Porch Group Inc. Common Stock,$19.25,-0.86,-4.276%,1854465363.00,United States,2020,358754,Technology,Computer Software: Prepackaged Software
PRDO,Perdoceo Education Corporation Common Stock,$12.23,-0.18,-1.45%,861479268.00,United States,,210210,Miscellaneous,Other Consumer Services
PRFT,Perficient Inc. Common Stock,$81.38,-1.12,-1.358%,2689349154.00,United States,1999,63443,Technology,EDP Services
PRFX,PainReform Ltd. Ordinary Shares,$2.9299,-0.0301,-1.017%,29481776.00,Israel,2020,2959,Health Care,Major Pharmaceuticals
PRGS,Progress Software Corporation Common Stock (DE),$46.43,-0.88,-1.86%,2043061844.00,United States,1991,62106,Technology,Computer Software: Prepackaged Software
PRIM,Primoris Services Corporation Common Stock,$28.394,-0.806,-2.76%,1525438915.00,United States,,81521,Basic Industries,Water Supply
PRLD,Prelude Therapeutics Incorporated Common Stock,$27.98,0.21,0.756%,1313890380.00,United States,2020,42248,Consumer Durables,Specialty Chemicals
PROF,Profound Medical Corp. Common Stock,$15.84,-0.54,-3.297%,322295751.00,Canada,,20796,,
PROG,Progenity Inc. Common Stock,$3.26,-0.13,-3.835%,252443117.00,United States,1995,836261,Consumer Durables,Specialty Chemicals
PROV,Provident Financial Holdings Inc. Common Stock,$17.06,-0.31,-1.785%,128232292.00,United States,,7208,Finance,Savings Institutions
PRPH,ProPhase Labs Inc. Common Stock (DE),$5.7682,-0.0718,-1.229%,87412762.00,United States,,36785,Health Care,Major Pharmaceuticals
PRPL,Purple Innovation Inc. Common Stock,$27.05,-0.11,-0.405%,1805615794.00,United States,2015,328271,Consumer Durables,Home Furnishings
PRPO,Precipio Inc.  Common Stock,$3.47,-0.07,-1.977%,78793509.00,United States,,526613,Capital Goods,Biotechnology: Laboratory Analytical Instruments
PRQR,ProQR Therapeutics N.V. Ordinary Shares,$6.45,-0.06,-0.922%,426524871.00,Netherlands,2014,290252,Health Care,Major Pharmaceuticals
PRSR,Prospector Capital Corp. Class A Ordinary Shares,$9.70,-0.01,-0.103%,394062500.00,United States,2021,4457,Finance,Business Services
PRSRU,Prospector Capital Corp. Unit,$9.99,-0.01,-0.10%,0.00,United States,2021,6589,Finance,Business Services
PRSRW,Prospector Capital Corp. Warrants,$0.9476,-0.0224,-2.309%,0.00,United States,2021,20142,Finance,Business Services
PRTA,Prothena Corporation plc Ordinary Shares,$53.26,-2.21,-3.984%,2352802682.00,United States,,128982,Health Care,Major Pharmaceuticals
PRTC,PureTech Health plc American Depositary Shares,$48.9999,0.00,0.00%,1401500187.00,United Kingdom,,158,Finance,Investment Managers
PRTG,Portage Biotech Inc. Common Stock,$21.13,-0.83,-3.78%,255322136.00,Canada,,34576,Health Care,Biotechnology: Biological Products (No Diagnostic Substances)
PRTH,Priority Technology Holdings Inc. Common Stock,$6.75,-0.54,-7.407%,456650312.00,United States,2016,16692,Technology,EDP Services
PRTK,Paratek Pharmaceuticals Inc. Common Stock,$6.73,-0.21,-3.026%,315825628.00,United States,,206146,Health Care,Major Pharmaceuticals
PRTS,CarParts.com Inc. Common Stock,$18.17,-0.92,-4.819%,873841615.00,United States,2007,349715,Consumer Services,Other Specialty Stores
PRVA,Privia Health Group Inc. Common Stock,$43.81,-0.87,-1.947%,4631913802.00,United States,2021,41621,Health Care,Medical/Nursing Services
PRVB,Provention Bio Inc. Common Stock,$6.2082,-2.0918,-25.202%,393443048.00,United States,2018,7037775,Health Care,Major Pharmaceuticals
PSAC,Property Solutions Acquisition Corp. Common Stock,$14.97,0.11,0.74%,441862170.00,United States,2020,680355,,
PSACU,Property Solutions Acquisition Corp. Unit,$18.845,0.315,1.70%,0.00,United States,2020,1309,,
PSACW,Property Solutions Acquisition Corp. Warrant,$3.87,0.02,0.519%,0.00,United States,2020,119088,,
PSAG,Property Solutions Acquisition Corporation II Class A Common Stock,$9.66,0.01,0.104%,0.00,United States,2021,220,,
PSAGU,Property Solutions Acquisition Corporation II Units,$9.90,-0.05,-0.503%,0.00,United States,2021,10052,,
PSAGW,Property Solutions Acquisition Corporation II Warrant,$1.33,0.15,12.712%,0.00,United States,2021,16267,Finance,Business Services
PSEC,Prospect Capital Corporation Common Stock,$8.36,-0.10,-1.182%,3241657507.00,United States,2004,1029169,Finance,Finance/Investors Services
PSHG,Performance Shipping Inc. Common Shares,$5.24,-0.23,-4.205%,26633484.00,Greece,,25685,Transportation,Marine Transportation
PSMT,PriceSmart Inc. Common Stock,$87.64,-3.19,-3.512%,2694885917.00,United States,,19325,Consumer Services,Department/Specialty Retail Stores
PSNL,Personalis Inc. Common Stock,$24.49,-0.22,-0.89%,1075316202.00,United States,2019,101458,Health Care,Biotechnology: In Vitro & In Vivo Diagnostic Substances
PSTI,Pluristem Therapeutics Inc. Common Stock,$3.79,-0.17,-4.293%,120295525.00,Israel,,103363,Health Care,Biotechnology: Biological Products (No Diagnostic Substances)
PSTV,PLUS THERAPEUTICS Inc. Common Stock ,$2.4199,0.0099,0.411%,51074935.00,United States,,99386,Health Care,Medical/Dental Instruments
PSTX,Poseida Therapeutics Inc. Common Stock,$8.51,-0.28,-3.185%,528936591.00,United States,2020,55740,Consumer Durables,Specialty Chemicals
PT,Pintec Technology Holdings Limited American Depositary Shares,$1.0375,0.0175,1.716%,44960986.00,China,2018,120695,Technology,Computer Software: Programming Data Processing
PTC,PTC Inc. Common Stock,$144.02,0.04,0.028%,16829429160.00,United States,,189697,Technology,Computer Software: Prepackaged Software
PTCT,PTC Therapeutics Inc. Common Stock,$42.61,-0.48,-1.114%,3002126240.00,United States,2013,46384,Health Care,Major Pharmaceuticals
PTE,PolarityTE Inc. Common Stock,$0.87,-0.0674,-7.19%,70150794.00,United States,,3304234,Consumer Durables,Specialty Chemicals
PTEN,Patterson-UTI Energy Inc. Common Stock,$9.32,-0.82,-8.087%,1756969241.00,United States,1993,1300464,Energy,Oil & Gas Production
PTGX,Protagonist Therapeutics Inc. Common Stock,$45.23,-1.13,-2.437%,2146094615.00,United States,2016,103674,Health Care,Major Pharmaceuticals
PTIC,PropTech Investment Corporation II Class A Common Stock,$9.78,0.00,0.00%,281175000.00,United States,2021,18,,
PTICU,PropTech Investment Corporation II Unit,$10.03,0.00,0.00%,0.00,United States,2020,5,,
PTICW,PropTech Investment Corporation II Warrant,$1.0276,-0.0024,-0.233%,0.00,United States,2021,25722,Finance,Business Services
PTIX,Protagenic Therapeutics Inc. Common Stock,$2.7001,0.0001,0.004%,39539670.00,United States,,276717,Health Care,Major Pharmaceuticals
PTIXW,Protagenic Therapeutics Inc. Warrant,$0.66,0.00,0.00%,0.00,United States,,400,,
PTMN,Portman Ridge Finance Corporation Common Stock,$2.37,0.00,0.00%,217634491.00,United States,,101431,Finance,Finance/Investors Services
PTNR,Partner Communications Company Ltd. American Depositary Shares,$4.50,0.00,0.00%,827574809.00,Israel,,3159,Public Utilities,Telecommunications Equipment
PTOC,Pine Technology Acquisition Corp. Class A Common Stock,$9.68,0.00,0.00%,417450000.00,United States,2021,1,,
PTOCU,Pine Technology Acquisition Corp. Unit,$9.94,0.01,0.101%,0.00,United States,2021,1000,Finance,Business Services
PTOCW,Pine Technology Acquisition Corp. Warrant,$0.8501,0.00,0.00%,0.00,United States,2021,82,Finance,Business Services
PTON,Peloton Interactive Inc. Class A Common Stock,$121.13,-0.47,-0.387%,36132264158.00,United States,2019,3108335,Consumer Services,Other Consumer Services
PTPI,Petros Pharmaceuticals Inc. Common Stock,$2.955,-0.185,-5.892%,28953861.00,United States,,54421,Health Care,Major Pharmaceuticals
PTRA,Proterra Inc. Common Stock,$16.84,-0.61,-3.496%,0.00,United States,2020,368564,,
PTRAW,Proterra Inc. Warrant,$5.20,-0.2017,-3.734%,0.00,United States,2020,67583,,
PTRS,Partners Bancorp Common Stock,$8.16,-0.09,-1.091%,144649448.00,United States,,16874,Finance,Major Banks
PTSI,P.A.M. Transportation Services Inc. Common Stock,$52.5061,0.1561,0.298%,300662688.00,United States,1986,2406,Transportation,Trucking Freight/Courier Services
PTVE,Pactiv Evergreen Inc. Common stock,$15.11,-0.22,-1.435%,2676852998.00,United States,2020,30906,Consumer Durables,Containers/Packaging
PUBM,PubMatic Inc. Class A Common Stock,$35.26,-0.44,-1.232%,1686362531.00,United States,2020,427144,Technology,Computer Software: Prepackaged Software
PUCK,Goal Acquisitions Corp. Common Stock,$9.655,0.035,0.364%,320171869.00,United States,2021,31652,,
PUCKU,Goal Acquisitions Corp. Unit,$10.25,-0.05,-0.485%,0.00,United States,2021,29615,,
PUCKW,Goal Acquisitions Corp. Warrant,$0.65,-0.0299,-4.398%,0.00,United States,2021,44146,Finance,Business Services
PULM,Pulmatrix Inc. Common Stock,$0.9711,-0.0389,-3.851%,54623464.00,United States,2014,241007,Health Care,Major Pharmaceuticals
PUYI,Puyi Inc. American Depository Shares,$5.3937,0.00,0.00%,325319268.00,China,2019,114,Finance,Investment Managers
PVAC,Penn Virginia Corporation Common Stock,$22.59,-2.93,-11.481%,855210639.00,United States,,363924,Energy,Oil & Gas Production
PVBC,Provident Bancorp Inc. (MD) Common Stock,$16.19,-0.15,-0.918%,296845949.00,United States,2015,25029,Finance,Major Banks
PWFL,PowerFleet Inc. Common Stock,$6.9399,-0.0401,-0.574%,249769791.00,United States,,92636,Capital Goods,Telecommunications Equipment
PWOD,Penns Woods Bancorp Inc. Common Stock,$23.56,-0.53,-2.20%,166353131.00,United States,,17809,Finance,Major Banks
PWP,Perella Weinberg Partners Class A Common Stock,$13.00,-0.22,-1.664%,409240000.00,United States,2020,229656,Finance,Investment Managers
PWPPW,Perella Weinberg Partners Warrant,$2.90,-0.22,-7.051%,0.00,United States,2020,11877,Finance,Investment Managers
PXLW,Pixelworks Inc.  Common Stock,$3.255,-0.115,-3.412%,169951430.00,United States,2000,73997,Technology,Semiconductors
PXS,Pyxis Tankers Inc. Common Stock,$0.8742,0.0251,2.956%,18847651.00,Greece,,618244,Transportation,Marine Transportation
PXSAP,Pyxis Tankers Inc. 7.75% Series A Cumulative Convertible Preferred Shares,$24.40,0.00,0.00%,0.00,Greece,,183,Transportation,Marine Transportation
PXSAW,Pyxis Tankers Inc. Warrant,$0.35,0.04,12.903%,0.00,Greece,,737,Transportation,Marine Transportation
PYPD,PolyPid Ltd. Ordinary Shares,$8.73,0.01,0.115%,163645090.00,Israel,2020,28549,Health Care,Medical/Dental Instruments
PYPL,PayPal Holdings Inc. Common Stock,$290.7695,0.5295,0.182%,341575088898.00,United States,,2807494,Miscellaneous,Business Services
PYR,PyroGenesis Canada Inc. Common Shares,$4.83,-0.22,-4.356%,805177688.00,Canada,,108246,,
PZZA,Papa John's International Inc. Common Stock,$103.89,-1.39,-1.32%,3795929703.00,United States,1993,92239,Consumer Services,Restaurants
QADA,QAD Inc. Class A Common Stock,$86.525,-0.075,-0.087%,1792098878.00,United States,,98456,Technology,Computer Software: Prepackaged Software
QADB,QAD Inc. Class B Common Stock,$85.86,-0.05,-0.058%,1778325451.00,United States,,2123,Technology,Computer Software: Prepackaged Software
QCOM,QUALCOMM Incorporated Common Stock,$140.14,-2.44,-1.711%,158077920000.00,United States,1991,2910033,Technology,Radio And Television Broadcasting And Communications Equipment
QCRH,QCR Holdings Inc. Common Stock,$46.99,-1.27,-2.632%,744646677.00,United States,,16273,Finance,Major Banks
QDEL,Quidel Corporation Common Stock,$126.38,1.09,0.87%,5377572126.00,United States,,317615,Health Care,Biotechnology: In Vitro & In Vivo Diagnostic Substances
QELL,Qell Acquisition Corp. Class A Ordinary Shares,$9.9515,-0.0085,-0.085%,472074281.00,United States,2020,204321,Finance,Business Services
QELLU,Qell Acquisition Corp. Unit,$10.9899,0.5499,5.267%,0.00,United States,2020,8978,Finance,Business Services
QELLW,Qell Acquisition Corp. Warrant,$1.6699,0.001,0.06%,0.00,United States,2020,13752,Finance,Business Services
QFIN,360 DigiTech Inc. American Depositary Shares,$33.925,-1.815,-5.078%,5170034334.00,China,2018,3858376,Finance,Finance: Consumer Services
QH,Quhuo Limited American Depository Shares,$3.84,0.11,2.949%,201194918.00,China,2020,16881,Miscellaneous,Business Services
QIPT,Quipt Home Medical Corp. Common Shares,$5.8829,-0.3171,-5.115%,180656199.00,United States,,59186,Capital Goods,Office Equipment/Supplies/Services
QIWI,QIWI plc American Depositary Shares,$10.37,-0.27,-2.538%,650333551.00,Cyprus,2013,160069,Miscellaneous,Business Services
QK,Q&K International Group Limited American Depositary Shares,$1.30,-0.11,-7.801%,70474730.00,China,2019,221047,Finance,Real Estate
QLGN,Qualigen Therapeutics Inc. Common Stock,$1.89,-0.06,-3.077%,54494482.00,United States,2015,70824,Health Care,Biotechnology: Commercial Physical & Biological Resarch
QLI,Qilian International Holding Group Ltd. Ordinary Shares,$4.08,-0.02,-0.488%,145860000.00,China,2021,23414,Health Care,Major Pharmaceuticals
QLYS,Qualys Inc. Common Stock,$104.95,2.65,2.59%,4107941041.00,United States,2012,113063,Technology,Computer Software: Prepackaged Software
QMCO,Quantum Corporation Common Stock,$6.75,-0.18,-2.597%,385336987.00,United States,,144645,Technology,Electronic Components
QNST,QuinStreet Inc. Common Stock,$18.16,-0.39,-2.102%,973729593.00,United States,2010,68744,Technology,Advertising
QQQX,Nuveen NASDAQ 100 Dynamic Overwrite Fund Shares of Beneficial Interest,$29.49,-0.03,-0.102%,1240524866.00,United States,,34743,Finance,Finance Companies
QRHC,Quest Resource Holding Corporation Common Stock,$6.86,-0.02,-0.291%,128422534.00,United States,,84690,Capital Goods,Building Products
QRTEA,Qurate Retail Inc. Series A Common Stock ,$12.425,-0.465,-3.607%,5115153932.00,United States,,1196864,Consumer Services,Catalog/Specialty Distribution
QRTEB,Qurate Retail Inc. Series B Common Stock ,$12.95,-0.06,-0.461%,5331287197.00,United States,,277,Consumer Services,Catalog/Specialty Distribution
QRTEP,Qurate Retail Inc. 8.0% Fixed Rate Cumulative Redeemable Preferred Stock,$108.26,0.16,0.148%,0.00,United States,,5798,Consumer Services,Catalog/Specialty Distribution
QRVO,Qorvo Inc. Common Stock,$192.93,-2.74,-1.40%,21465833031.00,United States,,296814,Capital Goods,Industrial Machinery/Components
QSI,Quantum-Si Incorporated Class A Common Stock,$12.535,-0.005,-0.04%,1709782273.00,United States,2020,789355,,
QSIAW,Quantum-Si Incorporated Warrant,$3.66,-0.2339,-6.007%,0.00,United States,2020,23581,,
QTNT,Quotient Limited Ordinary Shares,$3.53,-0.13,-3.552%,358391383.00,Switzerland,2014,153330,Health Care,Major Pharmaceuticals
QTRX,Quanterix Corporation Common Stock,$56.74,-1.50,-2.576%,2061738571.00,United States,2017,126329,Health Care,Industrial Specialties
QTT,Qutoutiao Inc. American Depositary Shares,$1.73,-0.06,-3.352%,497360731.00,China,2018,1019822,Technology,Computer Software: Prepackaged Software
QUIK,QuickLogic Corporation Common Stock,$6.54,-0.14,-2.096%,74884864.00,United States,1999,16422,Technology,Semiconductors
QUMU,Qumu Corporation Common Stock,$2.9999,0.1199,4.163%,52773560.00,United States,,1045124,Technology,Retail: Computer Software & Peripheral Equipment
QURE,uniQure N.V. Ordinary Shares,$29.66,-0.84,-2.754%,1362127462.00,Netherlands,2014,97291,Health Care,Major Pharmaceuticals
RAAC,Revolution Acceleration Acquisition Corp Class A Common Stock,$9.9799,0.0099,0.099%,382562830.00,United States,2021,113083,,
RAACU,Revolution Acceleration Acquisition Corp Unit,$10.75,0.15,1.415%,0.00,United States,2020,131,,
RAACW,Revolution Acceleration Acquisition Corp Warrant,$2.01,-0.02,-0.985%,0.00,United States,2021,9386,Capital Goods,Industrial Machinery/Components
RACB,Research Alliance Corp. II Class A Common Stock,$10.11,0.00,0.00%,193975515.00,United States,2021,20,,
RADA,RADA Electronic Industries Ltd. Ordinary Shares,$11.85,0.26,2.243%,515298020.00,Israel,,204700,,
RADI,Radius Global Infrastructure Inc. Class A Common Stock,$14.52,-0.13,-0.887%,1098942265.00,United States,,168041,Consumer Services,Telecommunications Equipment
RAIL,FreightCar America Inc. Common Stock,$5.6261,-0.1539,-2.663%,87440396.00,United States,2005,303356,Capital Goods,Railroads
RAIN,Rain Therapeutics Inc. Common Stock,$15.51,-0.36,-2.268%,410746057.00,United States,2021,42924,Health Care,Major Pharmaceuticals
RAMMU,Aries I Acquisition Corporation Unit,$10.0499,-0.0301,-0.299%,0.00,Cayman Islands,2021,16806,Finance,Business Services
RAND,Rand Capital Corporation Common Stock,$17.1123,-1.3586,-7.355%,44186851.00,United States,,2868,Finance,Finance/Investors Services
RAPT,RAPT Therapeutics Inc. Common Stock,$30.74,-0.99,-3.12%,902682160.00,United States,2019,43127,Health Care,Major Pharmaceuticals
RARE,Ultragenyx Pharmaceutical Inc. Common Stock,$92.94,-1.27,-1.348%,6271845205.00,United States,2014,337946,Health Care,Major Pharmaceuticals
RAVE,Rave Restaurant Group Inc. Common Stock,$1.59,0.10,6.711%,28627797.00,United States,,712312,Consumer Services,Restaurants
RAVN,Raven Industries Inc. Common Stock,$57.31,-0.09,-0.157%,2058439776.00,United States,,192152,Capital Goods,Office Equipment/Supplies/Services
RBB,RBB Bancorp Common Stock,$23.41,-0.78,-3.224%,458185764.00,United States,2017,16338,Finance,Commercial Banks
RBBN,Ribbon Communications Inc. Common Stock,$7.23,-0.24,-3.213%,1065466801.00,United States,,86158,Technology,EDP Services
RBCAA,Republic Bancorp Inc. Class A Common Stock,$45.01,-1.08,-2.343%,935810877.00,United States,1998,14588,Finance,Major Banks
RBCN,Rubicon Technology Inc. Common Stock,$9.4681,0.0657,0.699%,23115845.00,United States,2007,283,Technology,Semiconductors
RBKB,Rhinebeck Bancorp Inc. Common Stock,$10.70,-0.07,-0.65%,119126203.00,United States,2019,1635,Finance,Major Banks
RBNC,Reliant Bancorp Inc. Common Stock,$26.67,-0.52,-1.912%,437567222.00,United States,,10163,Finance,Major Banks
RCAT,Red Cat Holdings Inc. Common Stock,$2.48,-0.06,-2.362%,83995244.00,United States,,81133,Technology,Retail: Computer Software & Peripheral Equipment
RCEL,Avita Therapeutics Inc. Common Stock,$20.065,-0.435,-2.122%,498472447.00,Australia,,81961,Health Care,Medical Specialities
RCHG,Recharge Acquisition Corp. Class A Common Stock,$9.78,-0.07,-0.711%,244989000.00,United States,2020,11397,,
RCHGU,Recharge Acquisition Corp. Unit,$10.15,-0.09,-0.879%,0.00,United States,2020,10000,,
RCHGW,Recharge Acquisition Corp. Warrant,$0.8103,-0.0196,-2.362%,0.00,United States,2020,31520,Finance,Business Services
RCII,Rent-A-Center Inc. Common Stock,$52.23,-1.60,-2.972%,3463337246.00,United States,1995,233323,Technology,Diversified Commercial Services
RCKT,Rocket Pharmaceuticals Inc. Common Stock,$45.455,-0.735,-1.591%,2881708544.00,United States,2015,127459,Health Care,Major Pharmaceuticals
RCKY,Rocky Brands Inc. Common Stock,$52.225,-2.875,-5.218%,380377341.00,United States,1993,55672,Consumer Non-Durables,Shoe Manufacturing
RCLF,Rosecliff Acquisition Corp I Class A Common Stock,$9.70,0.03,0.31%,306762500.00,United States,2021,188,,
RCLFU,Rosecliff Acquisition Corp I Unit,$9.99,0.00,0.00%,0.00,United States,2021,78,,
RCLFW,Rosecliff Acquisition Corp I Warrants,$0.90,0.0001,0.011%,0.00,United States,2021,15045,Finance,Business Services
RCM,R1 RCM Inc. Common Stock,$22.29,-0.09,-0.402%,6211875989.00,United States,,325549,Consumer Services,Other Consumer Services
RCMT,RCM Technologies Inc. Common Stock,$3.9499,-0.0501,-1.253%,43800773.00,United States,,29907,Consumer Services,Military/Government/Technical
RCON,Recon Technology Ltd. Class A Ordinary Shares,$3.925,-0.165,-4.034%,28271116.00,China,2009,1955557,Energy,Oilfield Services/Equipment
RCRT,Recruiter.com Group Inc. Common Stock,$4.90,-0.02,-0.407%,16624651.00,United States,,142938,,
RCRTW,Recruiter.com Group Inc. Warrant,$1.65,0.05,3.125%,0.00,United States,,31120,,
RDCM,Radcom Ltd. Ordinary Shares,$10.905,-0.215,-1.933%,152055569.00,Israel,1997,3908,Technology,Computer peripheral equipment
RDFN,Redfin Corporation Common Stock,$61.99,-0.37,-0.593%,6449533267.00,United States,2017,466835,Finance,Real Estate
RDHL,Redhill Biopharma Ltd. American Depositary Shares,$6.8882,-0.0918,-1.315%,321816794.00,Israel,,68100,Health Care,Major Pharmaceuticals
RDI,Reading International Inc Class A Common Stock,$6.70,-0.03,-0.446%,146123000.00,United States,,33759,Consumer Services,Movies/Entertainment
RDIB,Reading International Inc Class B Common Stock,$23.10,0.00,0.00%,503797209.00,United States,,18,Consumer Services,Movies/Entertainment
RDNT,RadNet Inc. Common Stock,$34.00,-0.39,-1.134%,1791801326.00,United States,,47151,Health Care,Medical Specialities
RDUS,Radius Health Inc. Common Stock,$17.38,-0.47,-2.633%,821077413.00,United States,2014,125473,Health Care,Major Pharmaceuticals
RDVT,Red Violet Inc. Common Stock ,$22.85,-0.75,-3.178%,279724033.00,United States,,34762,Technology,Computer Software: Prepackaged Software
RDWR,Radware Ltd. Ordinary Shares,$30.95,-0.17,-0.546%,1409306393.00,Israel,1999,53657,Technology,EDP Services
REAL,The RealReal Inc. Common Stock,$19.24,-1.04,-5.128%,1747178147.00,United States,2019,1295148,Consumer Services,Catalog/Specialty Distribution
REAX,The Real Brokerage Inc. Common Shares,$8.60,-0.25,-2.825%,308336368.00,Canada,,11669,,
REDU,RISE Education Cayman Ltd American Depositary Shares,$2.5816,0.0116,0.451%,145816270.00,China,2017,7165,Miscellaneous,Service to the Health Industry
REED,Reeds Inc. Common Stock,$0.9774,-0.0088,-0.892%,91469373.00,United States,,207936,Consumer Non-Durables,Beverages (Production/Distribution)
REFR,Research Frontiers Incorporated Common Stock,$2.30,0.01,0.437%,72795911.00,United States,,45345,Capital Goods,Industrial Machinery/Components
REG,Regency Centers Corporation Common Stock,$63.42,-1.09,-1.69%,10772658187.00,United States,1993,208155,Consumer Services,Real Estate Investment Trusts
REGI,Renewable Energy Group Inc. Common Stock,$60.32,-1.48,-2.395%,2875001517.00,United States,2012,397664,Basic Industries,Major Chemicals
REGN,Regeneron Pharmaceuticals Inc. Common Stock,$578.78,-4.86,-0.833%,61665423458.00,United States,1991,254013,Health Care,Major Pharmaceuticals
REKR,Rekor Systems Inc. Common Stock,$9.70,-0.33,-3.29%,397646747.00,United States,,307229,Technology,EDP Services
RELI,Reliance Global Group Inc. Common Stock,$3.595,0.125,3.602%,39291603.00,United States,,13858,Finance,Specialty Insurers
RELIW,Reliance Global Group Inc. Series A Warrants,$0.60,0.0001,0.017%,0.00,United States,,118,Consumer Services,Broadcasting
RELL,Richardson Electronics Ltd. Common Stock,$8.16,-0.13,-1.568%,107774457.00,United States,1983,3421,Technology,Electronic Components
REPH,Recro Pharma Inc. Common Stock,$2.105,-0.075,-3.44%,97586703.00,United States,2014,120626,Health Care,Major Pharmaceuticals
REPL,Replimune Group Inc. Common Stock,$36.00,-3.54,-8.953%,1677922488.00,United States,2018,197101,Health Care,Major Pharmaceuticals
RESN,Resonant Inc. Common Stock,$3.005,-0.045,-1.475%,181571485.00,United States,2014,561679,Technology,Semiconductors
RETA,Reata Pharmaceuticals Inc. Class A Common Stock,$137.85,-1.44,-1.034%,5000896384.00,United States,2016,95216,Health Care,Major Pharmaceuticals
RETO,ReTo Eco-Solutions Inc. Common Shares,$1.115,-0.025,-2.193%,28025525.00,China,2017,268265,Capital Goods,Multi-Sector Companies
REVH,Revolution Healthcare Acquisition Corp. SAIL Class A Common Stock,$9.74,-0.03,-0.307%,562485000.00,United States,2021,84416,,
REVHU,Revolution Healthcare Acquisition Corp. SAIL Units,$10.00,-0.04,-0.398%,0.00,United States,2021,4279,Finance,Business Services
REVHW,Revolution Healthcare Acquisition Corp. SAIL Warrant.,$1.4099,0.0037,0.263%,0.00,United States,2021,8608,,
REYN,Reynolds Consumer Products Inc. Common Stock,$29.93,-0.38,-1.254%,6278074958.00,United States,2020,87718,Capital Goods,Office Equipment/Supplies/Services
RFIL,RF Industries Ltd. Common Stock,$7.30,-0.11,-1.484%,73007709.00,United States,,17622,Capital Goods,Electrical Products
RGCO,RGC Resources Inc. Common Stock,$25.38,-0.04,-0.157%,208846157.00,United States,,23564,Public Utilities,Oil & Gas Production
RGEN,Repligen Corporation Common Stock,$204.93,3.03,1.501%,11251572217.00,United States,1986,98536,Health Care,Medical/Dental Instruments
RGLD,Royal Gold Inc. Common Stock,$116.52,-0.42,-0.359%,7644468914.00,United States,,196790,,
RGLS,Regulus Therapeutics Inc. Common Stock,$0.7781,-0.0309,-3.82%,58298100.00,United States,2012,1566904,Health Care,Major Pharmaceuticals
RGNX,REGENXBIO Inc. Common Stock,$38.59,-1.15,-2.894%,1640436434.00,United States,2015,72417,Health Care,Biotechnology: Biological Products (No Diagnostic Substances)
RGP,Resources Connection Inc. Common Stock,$13.81,-0.44,-3.088%,453285934.00,United States,,44025,Miscellaneous,Business Services
RIBT,RiceBran Technologies Common Stock,$1.053,-0.017,-1.589%,47860920.00,United States,,147032,Consumer Non-Durables,Specialty Foods
RICK,RCI Hospitality Holdings Inc. Common Stock,$63.52,-3.38,-5.052%,571674283.00,United States,1995,34530,Consumer Services,Restaurants
RIDE,Lordstown Motors Corp. Class A Common Stock,$9.345,0.115,1.246%,1650134269.00,United States,2019,2323144,Capital Goods,Auto Manufacturing
