Symbol,Name,Last Sale,Net Change,% Change,Market Cap,Country,IPO Year,Volume,Sector,Industry
KBSF,KBS Fashion Group Limited Common Stock,$4.01,0.02,0.501%,10391109.00,China,2013,327367,Consumer Non-Durables,Apparel
KC,Kingsoft Cloud Holdings Limited American Depositary Shares,$30.04,-1.51,-4.786%,6708661581.00,China,2020,1273203,Technology,Computer Software: Prepackaged Software
KDMN,Kadmon Holdings Inc. Common Stock,$3.90,-0.01,-0.256%,670698070.00,United States,,513789,Health Care,Major Pharmaceuticals
KDNY,Chinook Therapeutics Inc. Common Stock,$13.65,-0.41,-2.916%,609012440.00,United States,2015,83554,Health Care,Major Pharmaceuticals
KDP,Keurig Dr Pepper Inc. Common Stock,$34.865,-0.315,-0.895%,49418446445.00,United States,,1476022,Consumer Non-Durables,Beverages (Production/Distribution)
KE,Kimball Electronics Inc. Common Stock,$20.93,-0.74,-3.415%,522351287.00,United States,,26950,Capital Goods,Industrial Machinery/Components
KELYA,Kelly Services Inc. Class A Common Stock,$22.75,-0.56,-2.402%,895645797.00,United States,,44845,Technology,Diversified Commercial Services
KELYB,Kelly Services Inc. Class B Common Stock,$22.75,-0.89,-3.765%,895645797.00,United States,,731,Technology,Diversified Commercial Services
KEQU,Kewaunee Scientific Corporation Common Stock,$14.36,-0.22,-1.509%,39673765.00,United States,,2443,Capital Goods,Medical Specialities
KERN,Akerna Corp. Common Stock,$3.86,-0.20,-4.926%,54266609.00,United States,2018,400548,Health Care,Managed Health Care
KERNW,Akerna Corp Warrant,$0.8512,-0.1488,-14.88%,0.00,United States,2018,55710,Health Care,Managed Health Care
KFFB,Kentucky First Federal Bancorp Common Stock,$7.34,-0.04,-0.542%,60384088.00,United States,,166,Finance,Savings Institutions
KFRC,Kforce Inc. Common Stock,$60.78,-2.41,-3.814%,1331989810.00,United States,1995,52538,Technology,Diversified Commercial Services
KHC,The Kraft Heinz Company Common Stock,$39.425,-0.955,-2.365%,48222583880.00,United States,,2270107,Consumer Non-Durables,Farming/Seeds/Milling
KIDS,OrthoPediatrics Corp. Common Stock,$60.775,-1.665,-2.667%,1194776758.00,United States,2017,45854,Health Care,Medical/Dental Instruments
KIII,Kismet Acquisition Three Corp. Class A Ordinary Shares,$9.66,0.01,0.104%,351986250.00,United States,2021,2019,Finance,Business Services
KIIIU,Kismet Acquisition Three Corp. Unit,$9.99,0.00,0.00%,0.00,United States,2021,3400,Finance,Business Services
KIIIW,Kismet Acquisition Three Corp. Warrant,$0.89,-0.0099,-1.10%,0.00,United States,2021,818,Finance,Business Services
KIN,Kindred Biosciences Inc. Common Stock,$9.17,0.01,0.109%,415681318.00,United States,2013,244095,Health Care,Major Pharmaceuticals
KINS,Kingstone Companies Inc. Common Stock,$7.78,0.05,0.647%,83095480.00,United States,,3921,Finance,Specialty Insurers
KINZ,KINS Technology Group Inc. Class A Common Stock,$9.87,0.00,0.00%,340515000.00,United States,2021,153,,
KINZU,KINS Technology Group Inc. Unit,$10.26,0.00,0.00%,0.00,United States,2020,155,,
KINZW,KINS Technology Group Inc. Warrant,$0.84,0.00,0.00%,0.00,United States,2021,36700,Finance,Business Services
KIRK,Kirkland's Inc. COMMONSTOCK,$22.03,0.02,0.091%,313984315.00,United States,2002,216112,Miscellaneous,Diversified Commercial Services
KLAC,KLA Corporation Common Stock,$306.75,-5.07,-1.626%,47019186935.00,United States,1980,354062,Capital Goods,Electronic Components
KLAQ,KL Acquisition Corp Class A Common Stock,$9.65,-0.05,-0.515%,346796875.00,United States,2021,7078,,
KLAQU,KL Acquisition Corp Unit,$9.96,0.01,0.101%,0.00,United States,2021,862,,
KLAQW,KL Acquisition Corp Warrant,$0.89,0.0198,2.275%,0.00,United States,2021,9550,Finance,Business Services
KLDO,Kaleido Biosciences Inc. Common Stock,$7.565,-0.345,-4.362%,321653610.00,United States,2019,65366,Health Care,Biotechnology: Biological Products (No Diagnostic Substances)
KLIC,Kulicke and Soffa Industries Inc. Common Stock,$55.06,-4.20,-7.087%,3416667582.00,Singapore,,1020486,Technology,Semiconductors
KLXE,KLX Energy Services Holdings Inc. Common Stock,$9.1288,-0.4312,-4.51%,80616497.00,United States,,74378,Energy,Oilfield Services/Equipment
KMDA,Kamada Ltd. Ordinary Shares,$5.79,-0.07,-1.195%,259075658.00,Israel,2013,10695,Health Care,Major Pharmaceuticals
KMPH,KemPharm Inc. Common Stock,$12.53,-0.42,-3.243%,357196431.00,United States,,561908,Health Care,Major Pharmaceuticals
KNBE,KnowBe4 Inc. Class A Common Stock,$29.14,1.71,6.234%,4944251842.00,United States,2021,176058,Technology,Computer Software: Programming Data Processing
KNDI,Kandi Technologies Group Inc Common Stock,$5.83,0.04,0.691%,439509446.00,China,,2389305,Capital Goods,Auto Parts:O.E.M.
KNSA,Kiniksa Pharmaceuticals Ltd. Class A Common Stock,$13.83,-0.25,-1.776%,945032030.00,United States,2018,93949,Health Care,Major Pharmaceuticals
KNSL,Kinsale Capital Group Inc. Common Stock,$172.05,1.80,1.057%,3924841763.00,United States,2016,35390,Finance,Property-Casualty Insurers
KNTE,Kinnate Biopharma Inc. Common Stock,$22.41,-1.12,-4.76%,974935486.00,United States,2020,28416,Health Care,Major Pharmaceuticals
KOD,Kodiak Sciences Inc Common Stock,$92.65,-3.66,-3.80%,4749701416.00,United States,2018,63356,Health Care,Major Pharmaceuticals
KOPN,Kopin Corporation Common Stock,$7.65,-0.12,-1.544%,698329278.00,United States,1992,667505,Capital Goods,Industrial Machinery/Components
KOR,Corvus Gold Inc. Common Shares,$2.75,-0.0166,-0.60%,348732918.00,Canada,,15848,Basic Industries,Precious Metals
KOSS,Koss Corporation Common Stock,$20.70,-0.49,-2.312%,176298236.00,United States,,159269,Consumer Non-Durables,Consumer Electronics/Appliances
KPLT,Katapult Holdings Inc. Common Stock,$10.75,-0.56,-4.951%,1057427674.00,United States,2019,312175,,
KPLTW,Katapult Holdings Inc. Warrant,$3.27,-0.11,-3.254%,0.00,United States,2019,17090,,
KPTI,Karyopharm Therapeutics Inc. Common Stock,$10.25,-0.26,-2.474%,769698812.00,United States,2013,345584,Miscellaneous,Diversified Commercial Services
KRBP,Kiromic BioPharma Inc. Common Stock,$4.77,-0.07,-1.446%,35068515.00,United States,2020,206287,Consumer Durables,Specialty Chemicals
KRKR,36Kr Holdings Inc. American Depositary Shares,$2.38,-0.02,-0.833%,91760407.00,China,2019,42067,Miscellaneous,Business Services
KRMD,Repro Med Systems Inc. Common Stock,$3.74,-0.09,-2.35%,166393251.00,United States,,113570,Health Care,Medical/Dental Instruments
KRNL,Kernel Group Holdings Inc. Class A Ordinary Shares,$9.76,0.00,0.00%,371795000.00,United States,2021,2094,Finance,Business Services
KRNLU,Kernel Group Holdings Inc. Units,$10.30,0.00,0.00%,0.00,United States,2021,70,Finance,Business Services
KRNLW,Kernel Group Holdings Inc. Warrants,$1.105,0.005,0.455%,0.00,United States,2021,33100,Finance,Business Services
KRNT,Kornit Digital Ltd. Ordinary Shares,$124.61,-1.08,-0.859%,5743109792.00,Israel,2015,59255,Capital Goods,Industrial Machinery/Components
KRNY,Kearny Financial Corp Common Stock,$11.70,-0.27,-2.256%,945277784.00,United States,,113644,Finance,Savings Institutions
KRON,Kronos Bio Inc. Common Stock,$23.33,-0.51,-2.139%,1308109694.00,United States,2020,79059,Consumer Durables,Specialty Chemicals
KROS,Keros Therapeutics Inc. Common Stock,$41.34,0.35,0.854%,963095086.00,United States,2020,26351,Consumer Durables,Specialty Chemicals
KRT,Karat Packaging Inc. Common Stock,$20.40,0.01,0.049%,402073800.00,United States,2021,15870,Capital Goods,Office Equipment/Supplies/Services
KRTX,Karuna Therapeutics Inc. Common Stock,$120.87,0.31,0.257%,3560575890.00,United States,2019,81491,Health Care,Major Pharmaceuticals
KRUS,Kura Sushi USA Inc. Class A Common Stock,$35.70,-1.50,-4.032%,300529811.00,United States,2019,13900,Consumer Services,Restaurants
KRYS,Krystal Biotech Inc. Common Stock,$69.075,-0.925,-1.321%,1533784610.00,United States,2017,25892,Health Care,Biotechnology: Biological Products (No Diagnostic Substances)
KSI,Kadem Sustainable Impact Corporation Class A common stock,$9.63,0.00,0.00%,210656250.00,United States,2021,9400,,
KSICU,Kadem Sustainable Impact Corporation Unit,$10.01,0.01,0.10%,0.00,United States,2021,6871,,
KSICW,Kadem Sustainable Impact Corporation Warrant,$0.7901,0.0301,3.961%,0.00,United States,2021,38987,Finance,Business Services
KSMT,Kismet Acquisition One Corp Ordinary Shares,$9.93,0.00,0.00%,315277500.00,Russia,2020,9951,Finance,Business Services
KSMTU,Kismet Acquisition One Corp Unit,$10.79,-0.19,-1.73%,0.00,Russia,2020,2209,Finance,Business Services
KSMTW,Kismet Acquisition One Corp Warrant,$1.2899,-0.0001,-0.008%,0.00,Russia,,1557,Finance,Business Services
KSPN,Kaspien Holdings Inc. Common Stock,$23.70,-0.10,-0.42%,58959722.00,United States,,545,Consumer Services,Consumer Electronics/Video Chains
KTCC,Key Tronic Corporation Common Stock,$6.53,-0.02,-0.305%,70260710.00,United States,1983,3180,Technology,Computer peripheral equipment
KTOS,Kratos Defense & Security Solutions Inc. Common Stock,$27.585,-0.485,-1.728%,3414745964.00,United States,,428924,Consumer Non-Durables,Ordnance And Accessories
KTRA,Kintara Therapeutics Inc. Common Stock,$1.8701,-0.0599,-3.104%,60998808.00,United States,,786096,Health Care,Major Pharmaceuticals
KURA,Kura Oncology Inc. Common Stock,$20.34,-0.80,-3.784%,1348006651.00,United States,,134972,Health Care,Major Pharmaceuticals
KURI,Alkuri Global Acquisition Corp. Class A common stock,$9.89,-0.04,-0.403%,426506250.00,United States,2021,159584,Finance,Business Services
KURIU,Alkuri Global Acquisition Corp. Unit,$10.24,-0.02,-0.195%,0.00,United States,2021,13020,Finance,Business Services
KURIW,Alkuri Global Acquisition Corp. Warrant,$1.44,-0.05,-3.356%,0.00,United States,2021,9877,Finance,Business Services
KVHI,KVH Industries Inc. Common Stock,$12.32,0.00,0.00%,231131652.00,United States,1996,22750,Technology,Radio And Television Broadcasting And Communications Equipment
KVSA,Khosla Ventures Acquisition Co. Class A Common Stock,$9.91,0.02,0.202%,450805900.00,United States,2021,243902,,
KVSB,Khosla Ventures Acquisition Co. II Class A Common Stock,$10.42,0.51,5.146%,538030573.00,United States,2021,14965562,,
KVSC,Khosla Ventures Acquisition Co. III Class A Common Stock,$10.00,0.17,1.729%,663302220.00,United States,2021,126114,,
KXIN,Kaixin Auto Holdings Ordinary Share,$2.23,0.01,0.45%,150357734.00,China,2017,165515,Finance,Business Services
KYMR,Kymera Therapeutics Inc. Common Stock,$55.05,-1.38,-2.446%,2478906675.00,United States,2020,335653,Consumer Durables,Specialty Chemicals
KZIA,Kazia Therapeutics Limited American Depositary Shares,$9.84,0.00,0.00%,127546415.00,Australia,,4806,Health Care,Major Pharmaceuticals
KZR,Kezar Life Sciences Inc. Common Stock,$5.375,0.015,0.28%,258482062.00,United States,2018,50743,Health Care,Major Pharmaceuticals
LAAAU,Lakeshore Acquisition I Corp. Unit,$10.22,0.00,0.00%,0.00,China,2021,45,,
LABP,Landos Biopharma Inc. Common Stock,$11.00,-0.12,-1.079%,441293578.00,United States,2021,5253,Consumer Durables,Specialty Chemicals
LAKE,Lakeland Industries Inc. Common Stock,$21.275,-0.755,-3.427%,170901926.00,United States,1986,60126,Health Care,Industrial Specialties
LAMR,Lamar Advertising Company Class A Common Stock,$104.51,-0.61,-0.58%,10566965968.00,United States,1996,76627,Consumer Services,Real Estate Investment Trusts
LANC,Lancaster Colony Corporation Common Stock,$193.795,-0.205,-0.106%,5338083275.00,United States,,19751,Consumer Non-Durables,Packaged Foods
LAND,Gladstone Land Corporation Common Stock,$23.44,-0.33,-1.388%,688137526.00,United States,2013,192988,Consumer Services,Real Estate Investment Trusts
LANDM,Gladstone Land Corporation 5.00% Series D Cumulative Term Preferred Stock,$26.00,0.00,0.00%,626662556.00,United States,,744,Consumer Services,Real Estate Investment Trusts
LANDO,Gladstone Land Corporation 6.00% Series B Cumulative Redeemable Preferred Stock,$25.80,-0.06,-0.232%,0.00,United States,,12137,Consumer Services,Real Estate Investment Trusts
LARK,Landmark Bancorp Inc. Common Stock,$27.0201,-0.0199,-0.074%,128523916.00,United States,,1689,Finance,Major Banks
LASR,nLIGHT Inc. Common Stock,$36.36,-0.37,-1.007%,1556491172.00,United States,2018,97678,Technology,Semiconductors
LATN,Union Acquisition Corp. II Ordinary Shares,$10.09,0.00,0.00%,252250000.00,United States,2019,1,Finance,Business Services
LATNW,Union Acquisition Corp. II Warrant,$0.90,-0.0396,-4.215%,0.00,United States,2019,25700,Finance,Business Services
LAUR,Laureate Education Inc. Class A Common Stock,$14.83,0.04,0.27%,2903082346.00,United States,2017,165024,Miscellaneous,Other Consumer Services
LAWS,Lawson Products Inc. Common Stock,$53.00,0.23,0.436%,480526991.00,United States,,1013,Capital Goods,Industrial Machinery/Components
LAZR,Luminar Technologies Inc.  Class A Common Stock,$20.41,-0.58,-2.763%,6935977631.00,United States,2019,2457856,Technology,EDP Services
LAZY,Lazydays Holdings Inc. Common Stock,$19.3781,-0.7219,-3.592%,208457837.00,United States,,92845,Consumer Services,Other Specialty Stores
LBAI,Lakeland Bancorp Inc. Common Stock,$16.89,-0.41,-2.37%,854656785.00,United States,,48850,Finance,Major Banks
LBC,Luther Burbank Corporation Common Stock,$11.955,-0.175,-1.443%,624432508.00,United States,2017,36912,Finance,Commercial Banks
LBPH,Longboard Pharmaceuticals Inc. Common Stock,$9.1001,0.0001,0.001%,156661407.00,United States,2021,10574,Health Care,Major Pharmaceuticals
LBPS,4D pharma plc American Depositary Shares,$11.00,0.50,4.762%,247913820.00,United Kingdom,,4514,Health Care,Major Pharmaceuticals
LBPSW,4D pharma plc Warrant,$1.0495,0.0295,2.892%,0.00,United Kingdom,,23469,Health Care,Major Pharmaceuticals
LBRDA,Liberty Broadband Corporation Class A Common Stock,$169.49,-1.28,-0.75%,32081910582.00,United States,,21286,Consumer Services,Television Services
LBRDK,Liberty Broadband Corporation Class C Common Stock,$175.23,-1.15,-0.652%,33168406344.00,United States,,248820,Consumer Services,Television Services
LBRDP,Liberty Broadband Corporation Series A Cumulative Redeemable Preferred Stock,$28.10,-0.16,-0.566%,0.00,United States,,5385,Consumer Services,Television Services
LBTYA,Liberty Global plc Class A Ordinary Shares,$26.25,-0.88,-3.244%,14716471114.00,United Kingdom,,364279,Consumer Services,Television Services
LBTYB,Liberty Global plc Class B Ordinary Shares,$28.9312,0.00,0.00%,16219625489.00,United Kingdom,,53,Consumer Services,Television Services
LBTYK,Liberty Global plc Class C Ordinary Shares,$26.22,-0.86,-3.176%,14699652290.00,United Kingdom,,741438,Consumer Services,Television Services
LCA,Landcadia Holdings IV Inc. Class A Common Stock,$9.78,0.03,0.308%,0.00,United States,2021,213,,
LCAA,L Catterton Asia Acquisition Corp Class A Ordinary Shares,$9.70,0.00,0.00%,0.00,Singapore,2021,458,Finance,Business Services
LCAAU,L Catterton Asia Acquisition Corp Units,$9.95,0.00,0.00%,0.00,Singapore,2021,1,Finance,Business Services
LCAAW,L Catterton Asia Acquisition Corp Warrant,$1.00,0.00,0.00%,0.00,Singapore,2021,1,,
LCAHU,Landcadia Holdings IV Inc. Units,$10.0154,0.0654,0.657%,0.00,United States,2021,2091,,
LCAHW,Landcadia Holdings IV Inc. Warrant ,$1.14,0.0399,3.627%,0.00,United States,2021,7600,Finance,Business Services
LCAP,Lionheart Acquisition Corp. II Class A Common Stock,$9.83,-0.0308,-0.312%,289002000.00,United States,2020,1355,,
LCAPU,Lionheart Acquisition Corp. II Unit,$10.19,-0.15,-1.451%,0.00,United States,2020,2075,,
LCAPW,Lionheart Acquisition Corp. II Warrant,$0.8602,-0.0197,-2.239%,0.00,United States,2020,500,Finance,Business Services
LCNB,LCNB Corporation Common Stock,$16.24,-0.49,-2.929%,210620019.00,United States,,40911,Finance,Major Banks
LCUT,Lifetime Brands Inc. Common Stock,$14.035,-0.445,-3.073%,308488486.00,United States,1991,46465,Consumer Durables,Wholesale Distributors
LCY,Landcadia Holdings III Inc. Class A Common Stock,$12.09,-0.30,-2.421%,755625000.00,United States,2020,177063,Capital Goods,Industrial Machinery/Components
LCYAU,Landcadia Holdings III Inc. Unit ,$13.04,-0.45,-3.336%,0.00,United States,2020,32090,,
LCYAW,Landcadia Holdings III Inc. Warrant,$2.55,-0.17,-6.25%,0.00,United States,2020,46912,Capital Goods,Industrial Machinery/Components
LDHA,LDH Growth Corp I Class A Ordinary Shares,$9.70,-0.01,-0.103%,278875000.00,United States,2021,692,Finance,Business Services
LDHAU,LDH Growth Corp I Units,$9.98,-0.01,-0.10%,0.00,United States,2021,1188,Finance,Business Services
LDHAW,LDH Growth Corp I Warrant,$1.1975,0.05,4.357%,0.00,United States,2021,5367,Finance,Business Services
LE,Lands' End Inc. Common Stock,$38.35,-1.90,-4.72%,1264782540.00,United States,,110973,Consumer Services,Clothing/Shoe/Accessory Stores
LECO,Lincoln Electric Holdings Inc. Common Shares,$133.30,-1.22,-0.907%,7936373144.00,United States,,317813,Capital Goods,Industrial Machinery/Components
LEDS,SemiLEDS Corporation Common Stock,$16.75,0.80,5.016%,68745149.00,Taiwan,2010,533586,Technology,Semiconductors
LEE,Lee Enterprises Incorporated Common Stock,$27.00,-0.03,-0.111%,158674545.00,United States,,20564,Consumer Services,Newspapers/Magazines
LEGA,Lead Edge Growth Opportunities Ltd Class A Ordinary Shares,$9.70,0.00,0.00%,220626558.00,United States,2021,3910,Finance,Business Services
LEGAU,Lead Edge Growth Opportunities Ltd Units,$10.00,0.02,0.20%,0.00,United States,2021,25990,Finance,Business Services
LEGAW,Lead Edge Growth Opportunities Ltd Warrant,$1.39,0.09,6.923%,0.00,United States,2021,928,Finance,Business Services
LEGH,Legacy Housing Corporation Common Stock (TX),$17.40,-0.48,-2.685%,421125779.00,United States,2018,28553,Basic Industries,Homebuilding
LEGN,Legend Biotech Corporation American Depositary Shares,$38.845,-2.165,-5.279%,5258245539.00,United States,2020,345171,Health Care,Major Pharmaceuticals
LEGO,Legato Merger Corp. Common stock,$10.14,0.11,1.097%,307313345.00,United States,2021,702871,,
LEGOU,Legato Merger Corp. Units,$12.1801,0.3351,2.829%,0.00,United States,2021,6126,,
LEGOW,Legato Merger Corp. Warrant,$2.11,0.26,14.054%,0.00,United States,2021,495479,Finance,Business Services
LESL,Leslie's Inc. Common Stock,$26.31,-0.95,-3.485%,4980076931.00,United States,2020,686242,Consumer Services,
LEVL,Level One Bancorp Inc. Common Stock,$26.67,-0.65,-2.379%,203469591.00,United States,2018,31089,Finance,Major Banks
LEVLP,Level One Bancorp Inc. Depositary Shares Each Representing a 1/100th Interest in a Share of 7.50% Non-Cumulative Perpetual Preferred Stock Series B,$27.28,0.00,0.00%,0.00,United States,,1000,,
LEXX,Lexaria Bioscience Corp. Common Stock,$6.70,-0.17,-2.475%,34199024.00,Canada,,64957,Basic Industries,Precious Metals
LEXXW,Lexaria Bioscience Corp. Warrant,$2.37,-0.1435,-5.709%,0.00,Canada,,1700,Basic Industries,Precious Metals
LFMD,LifeMD Inc. Common Stock,$10.81,-0.12,-1.098%,287242196.00,United States,,162346,Miscellaneous,Diversified Commercial Services
LFST,LifeStance Health Group Inc. Common Stock,$28.27,0.67,2.428%,10563047279.00,United States,2021,306386,,
LFTR,Lefteris Acquisition Corp. Class A Common Stock,$9.7419,-0.0081,-0.083%,252192141.00,United States,2020,15222,,
LFTRU,Lefteris Acquisition Corp. Unit,$10.00,-0.08,-0.794%,0.00,United States,2020,1500,,
LFTRW,Lefteris Acquisition Corp. Warrant,$1.07,-0.01,-0.926%,0.00,United States,2020,10624,Finance,Business Services
LFUS,Littelfuse Inc. Common Stock,$247.195,-5.435,-2.151%,6069929833.00,United States,,18440,Technology,Electronic Components
LFVN,Lifevantage Corporation Common Stock (Delaware),$7.03,-0.08,-1.125%,98454096.00,United States,,25234,Consumer Non-Durables,Farming/Seeds/Milling
LGAC,Lazard Growth Acquisition Corp. I Ordinary Shares,$9.73,-0.03,-0.307%,699343750.00,,2021,78342,Finance,Business Services
LGACU,Lazard Growth Acquisition Corp. I Units,$9.98,-0.01,-0.10%,0.00,,2021,13887,Finance,Business Services
LGACW,Lazard Growth Acquisition Corp. I Warrants,$1.20,0.01,0.84%,0.00,,2021,2386,Finance,Business Services
LGHL,Lion Group Holding Ltd. American Depositary Share,$2.0185,-0.0215,-1.054%,75030221.00,China,,276671,Finance,Investment Bankers/Brokers/Service
LGHLW,Lion Group Holding Ltd. Warrant,$0.225,-0.0084,-3.599%,0.00,China,,29550,Finance,Investment Bankers/Brokers/Service
LGIH,LGI Homes Inc. Common Stock,$161.01,-4.40,-2.66%,4014692413.00,United States,2013,65249,Capital Goods,Homebuilding
LGND,Ligand Pharmaceuticals Incorporated Common Stock,$130.27,-2.98,-2.236%,2169266462.00,United States,,29239,Health Care,Major Pharmaceuticals
LGO,Largo Resources Ltd. Common Shares,$14.94,-0.22,-1.451%,964627529.00,Canada,,87036,,
LGVN,Longeveron Inc. Class A Common Stock,$8.0077,-0.2923,-3.522%,152014790.00,United States,2021,80833,Consumer Durables,Specialty Chemicals
LHAA,Lerer Hippeau Acquisition Corp. Class A Common Stock,$9.75,-0.08,-0.814%,278051036.00,United States,2021,6091,,
LHCG,LHC Group Common Stock,$204.57,0.28,0.137%,6477946965.00,United States,2005,34006,Health Care,Medical/Nursing Services
LHDX,Lucira Health Inc. Common Stock,$6.44,-0.30,-4.451%,248412934.00,United States,2021,192622,Health Care,Precision Instruments
LI,Li Auto Inc. American Depositary Shares,$32.68,0.01,0.031%,29563770985.00,China,2020,11231697,Capital Goods,Auto Manufacturing
LIFE,aTyr Pharma Inc. Common Stock,$4.7472,-0.0928,-1.917%,76262073.00,United States,2015,43353,Health Care,Biotechnology: Biological Products (No Diagnostic Substances)
LILA,Liberty Latin America Ltd. Class A Common Stock,$13.58,-0.16,-1.164%,3178909852.00,United States,,119318,Consumer Services,Television Services
LILAK,Liberty Latin America Ltd. Class C Common Stock,$13.69,-0.21,-1.511%,3204659490.00,United States,,273487,Consumer Services,Television Services
LINC,Lincoln Educational Services Corporation Common Stock,$7.69,-0.11,-1.41%,206830009.00,United States,2005,78433,Miscellaneous,Service to the Health Industry
LIND,Lindblad Expeditions Holdings Inc. Common Stock,$15.285,-0.595,-3.747%,766190064.00,United States,2013,89633,,
LINK,Interlink Electronics Inc. Common Stock,$8.4649,-0.196,-2.263%,55875899.00,United States,,2824,Capital Goods,Industrial Machinery/Components
LIQT,LiqTech International Inc. Common Stock,$7.10,-0.25,-3.401%,154619348.00,Denmark,,19265,Capital Goods,Industrial Machinery/Components
LITE,Lumentum Holdings Inc. Common Stock,$82.54,-0.93,-1.114%,6264786000.00,United States,,355176,Technology,Computer peripheral equipment
LITTU,Logistics Innovation Technologies Corp. Units,$9.97,0.06,0.605%,0.00,United States,2021,1201,,
LIVE,Live Ventures Incorporated Common Stock,$60.455,-1.355,-2.192%,94964769.00,United States,,8880,Capital Goods,Recreational Products/Toys
LIVK,LIV Capital Acquisition Corp. Class A Ordinary Shares,$10.00,0.00,0.00%,101325000.00,Mexico,2020,10311,Finance,Business Services
LIVKU,LIV Capital Acquisition Corp. Unit,$10.89,0.12,1.114%,0.00,Mexico,2019,13440,Finance,Business Services
LIVKW,LIV Capital Acquisition Corp. Warrant,$1.00,-0.02,-1.961%,0.00,Mexico,2020,65252,Finance,Business Services
LIVN,LivaNova PLC Ordinary Shares,$80.355,-2.705,-3.257%,3925872575.00,United Kingdom,,79307,Health Care,Biotechnology: Electromedical & Electrotherapeutic Apparatus
LIVX,LiveXLive Media Inc. Common Stock,$4.46,0.01,0.225%,336634453.00,United States,,383248,Consumer Services,Movies/Entertainment
LIXT,Lixte Biotechnology Holdings Inc. Common Stock,$3.11,-0.09,-2.813%,42492739.00,United States,,9477,Health Care,Major Pharmaceuticals
LIXTW,Lixte Biotechnology Holdings Inc. Warrants,$0.8499,0.0843,11.011%,0.00,United States,,200,Health Care,Major Pharmaceuticals
LIZI,LIZHI INC. American Depositary Shares,$6.17,-0.53,-7.91%,309093301.00,China,2020,742289,Technology,Computer Software: Programming Data Processing
LJAQ,LightJump Acquisition Corporation Common Stock,$9.82,0.00,0.00%,170573400.00,United States,2021,185,,
LJAQU,LightJump Acquisition Corporation Unit,$10.055,-0.055,-0.544%,0.00,United States,2021,506,,
LJAQW,LightJump Acquisition Corporation Warrant,$0.755,-0.005,-0.658%,0.00,United States,2021,650,Finance,Business Services
LJPC,La Jolla Pharmaceutical Company Common Stock,$4.01,-0.30,-6.961%,110160226.00,United States,1994,95542,Health Care,Biotechnology: Biological Products (No Diagnostic Substances)
LKCO,Luokung Technology Corp Ordinary Shares,$2.10,-0.11,-4.977%,667478209.00,China,,7485714,Technology,EDP Services
LKFN,Lakeland Financial Corporation Common Stock,$58.42,-2.16,-3.566%,1477494845.00,United States,,26551,Finance,Major Banks
LKQ,LKQ Corporation Common Stock,$49.28,-1.11,-2.203%,14890439133.00,United States,,502104,Capital Goods,Automotive Aftermarket
LLNW,Limelight Networks Inc. Common Stock,$2.68,-0.42,-13.548%,336845352.00,United States,2007,4101854,,
LMACA,Liberty Media Acquisition Corporation Series A Common Stock,$10.18,0.03,0.296%,585350000.00,United States,2021,16606,,
LMACU,Liberty Media Acquisition Corporation Unit,$10.60,0.03,0.284%,0.00,United States,2021,6526,,
LMACW,Liberty Media Acquisition Corporation Warrants,$2.2093,-0.0406,-1.805%,0.00,United States,2021,2784,Finance,Business Services
LMAO,LMF Acquisition Opportunities Inc. Class A common stock,$9.88,-0.02,-0.202%,128845080.00,United States,2021,904,,
LMAOU,LMF Acquisition Opportunities Inc. Unit,$10.42,0.00,0.00%,0.00,United States,2021,492,,
LMAOW,LMF Acquisition Opportunities Inc. Warrant,$0.58,0.0499,9.413%,0.00,United States,2021,15049,Finance,Business Services
LMAT,LeMaitre Vascular Inc. Common Stock,$57.77,-1.97,-3.298%,1190454201.00,United States,2006,91041,Health Care,Medical/Dental Instruments
LMB,Limbach Holdings Inc. Common Stock,$8.85,-0.33,-3.595%,90727510.00,United States,,26973,Consumer Services,Military/Government/Technical
LMFA,LM Funding America Inc. Common Stock,$3.96,-0.18,-4.348%,21440612.00,United States,2015,60728,Finance,Finance: Consumer Services
LMNL,Liminal BioSciences Inc. Common Shares,$3.89,0.02,0.517%,116481534.00,Canada,,78704,,
LMNR,Limoneira Co Common Stock,$16.93,-0.59,-3.368%,299413822.00,United States,,20791,,
