Symbol,Name,Last Sale,Net Change,% Change,Market Cap,Country,IPO Year,Volume,Sector,Industry
DSP,Viant Technology Inc. Class A Common Stock,$26.90,-0.78,-2.818%,1585366537.00,United States,2021,89721,Technology,EDP Services
DSPG,DSP Group Inc. Common Stock,$14.65,-0.45,-2.98%,354922356.00,United States,1994,71610,Technology,Semiconductors
DSWL,Deswell Industries Inc. Common Shares,$4.67,0.065,1.412%,74324166.00,Macau,1995,27628,Consumer Non-Durables,Plastic Products
DTEA,DAVIDsTEA Inc. Common Stock,$4.04,-0.14,-3.349%,106073307.00,Canada,2015,114233,Consumer Services,Restaurants
DTIL,Precision BioSciences Inc. Common Stock,$11.72,-0.64,-5.178%,673669421.00,United States,2019,354798,Health Care,Biotechnology: Biological Products (No Diagnostic Substances)
DTOC,Digital Transformation Opportunities Corp. Class A Common Stock,$9.78,0.08,0.825%,407703750.00,United States,2021,790,Finance,Business Services
DTOCU,Digital Transformation Opportunities Corp. Units,$9.93,-0.06,-0.601%,0.00,United States,2021,513,,
DTOCW,Digital Transformation Opportunities Corp. Warrant,$0.9998,0.0678,7.275%,0.00,United States,2021,13822,Finance,Business Services
DTSS,Datasea Inc. Common Stock,$2.3352,0.1252,5.665%,50146407.00,China,,130497,Technology,Retail: Computer Software & Peripheral Equipment
DTST,Data Storage Corporation Common Stock,$6.81,0.95,16.212%,33088898.00,United States,,2635891,Technology,EDP Services
DTSTW,Data Storage Corporation Warrant,$1.4599,0.1815,14.197%,0.00,United States,,132478,,
DUNE,Dune Acquisition Corporation Class A Common Stock,$9.77,0.02,0.205%,,United States,2021,4938,,
DUNEU,Dune Acquisition Corporation Unit,$10.176,0.056,0.553%,0.00,United States,2020,2956,,
DUNEW,Dune Acquisition Corporation Warrant,$0.7999,0.0499,6.653%,0.00,United States,2021,26708,Finance,Business Services
DUO,Fangdd Network Group Ltd. American Depositary Shares,$2.86,-0.15,-4.983%,228361742.00,China,2019,173863,Technology,Computer Software: Programming Data Processing
DUOT,Duos Technologies Group Inc. Common Stock,$10.0576,-0.249,-2.416%,36056204.00,United States,,5815,Technology,Computer Software: Prepackaged Software
DVAX,Dynavax Technologies Corporation Common Stock,$9.51,-0.39,-3.939%,1117467434.00,United States,2004,766183,Health Care,Major Pharmaceuticals
DWSN,Dawson Geophysical Company Common Stock,$2.6546,0.0146,0.553%,62324890.00,United States,,5205,Energy,Oil & Gas Production
DXCM,DexCom Inc. Common Stock,$437.15,5.56,1.288%,42274972382.00,United States,2005,145122,Health Care,Medical/Dental Instruments
DXPE,DXP Enterprises Inc. Common Stock,$32.70,-0.91,-2.708%,628066382.00,United States,,43182,Capital Goods,Industrial Machinery/Components
DXYN,Dixie Group Inc. (The) Common Stock,$3.2501,0.0501,1.566%,51223500.00,United States,,85240,Consumer Durables,Home Furnishings
DYAI,Dyadic International Inc. Common Stock,$3.3928,-0.1372,-3.887%,93485744.00,United States,,67974,Health Care,Biotechnology: Biological Products (No Diagnostic Substances)
DYN,Dyne Therapeutics Inc. Common Stock,$20.78,-0.46,-2.166%,1069066644.00,United States,2020,38545,Consumer Durables,Specialty Chemicals
DYNS,Dynamics Special Purpose Corp. Class A Common Stock,$9.94,-0.01,-0.101%,292887070.00,United States,2021,39205,Technology,Computer Manufacturing
DYNT,Dynatronics Corporation Common Stock,$1.2125,0.0125,1.042%,21054643.00,United States,,27125,Health Care,Medical/Dental Instruments
DZSI,DZS Inc. Common Stock,$20.18,-0.52,-2.512%,543198903.00,United States,,37024,Public Utilities,Telecommunications Equipment
EA,Electronic Arts Inc. Common Stock,$142.12,-1.29,-0.90%,40608464348.00,United States,,532713,Technology,Computer Software: Prepackaged Software
EAC,Edify Acquisition Corp. Class A Common Stock,$9.65,0.00,0.00%,332925000.00,United States,2021,4976,,
EACPU,Edify Acquisition Corp. Units,$9.98,0.00,0.00%,0.00,United States,2021,201869,,
EACPW,Edify Acquisition Corp. Warrant,$0.70,0.00,0.00%,0.00,United States,2021,33950,Finance,Business Services
EAR,Eargo Inc. Common Stock,$37.96,0.20,0.53%,1470249182.00,United States,2020,92153,Health Care,Medical Specialities
EARS,Auris Medical Holding Ltd. Common Shares 0.01 SF (Bermuda),$3.47,-0.11,-3.073%,24600607.00,Bermuda,2014,1021707,Health Care,Major Pharmaceuticals
EAST,Eastside Distilling Inc. Common Stock,$2.9257,0.0557,1.941%,36330105.00,United States,,140964,Consumer Non-Durables,Beverages (Production/Distribution)
EBAC,European Biotech Acquisition Corp. Class A Ordinary Shares,$9.74,0.00,0.00%,159722130.00,Netherlands,2021,25,Finance,Business Services
EBACU,European Biotech Acquisition Corp. Units,$9.99,0.00,0.00%,0.00,Netherlands,2021,1270,Finance,Business Services
EBACW,European Biotech Acquisition Corp. Warrant,$1.00,0.00,0.00%,0.00,Netherlands,2021,17,Finance,Business Services
EBAY,eBay Inc. Common Stock,$69.03,-1.05,-1.498%,47027490733.00,United States,1998,2469350,Consumer Services,Catalog/Specialty Distribution
EBC,Eastern Bankshares Inc. Common Stock,$19.66,-0.63,-3.105%,3671665308.00,United States,2020,267940,Finance,Major Banks
EBET,Esports Technologies Inc. Common Stock,$21.17,0.29,1.389%,276242440.00,United States,2021,32438,Consumer Services,Services-Misc. Amusement & Recreation
EBIX,Ebix Inc. Common Stock,$31.62,-0.78,-2.407%,978287544.00,United States,,107615,Technology,EDP Services
EBMT,Eagle Bancorp Montana Inc. Common Stock,$22.80,-0.19,-0.826%,154480192.00,United States,,4625,Finance,Savings Institutions
EBON,Ebang International Holdings Inc. Class A Ordinary Shares,$2.88,0.01,0.348%,535205771.00,China,2020,1379553,Technology,Semiconductors
EBSB,Meridian Bancorp Inc. Common Stock,$19.48,-0.76,-3.755%,1021809199.00,United States,,44288,Finance,Major Banks
EBTC,Enterprise Bancorp Inc Common Stock,$33.50,0.01,0.03%,402199895.00,United States,,10142,Finance,Major Banks
ECHO,Echo Global Logistics Inc. Common Stock,$28.21,-1.45,-4.889%,751388950.00,United States,2009,342385,Transportation,Oil Refining/Marketing
ECOL,US Ecology Inc Common Stock,$37.10,-0.63,-1.67%,1169107220.00,United States,,46644,Public Utilities,Environmental Services
ECOLW,US Ecology Inc. Warrant,$9.64,0.00,0.00%,0.00,United States,,202,Public Utilities,Environmental Services
ECOR,electroCore Inc. Common Stock,$1.075,-0.055,-4.867%,52185213.00,United States,2018,912516,Health Care,Medical/Dental Instruments
ECPG,Encore Capital Group Inc Common Stock,$46.84,-0.60,-1.265%,1452501140.00,United States,,55511,,
EDAP,EDAP TMS S.A. American Depositary Shares,$6.80,-0.10,-1.449%,226753725.00,France,1997,42938,Health Care,Biotechnology: Electromedical & Electrotherapeutic Apparatus
EDIT,Editas Medicine Inc. Common Stock,$49.0726,-5.8274,-10.615%,3328419563.00,United States,2016,1916114,Health Care,Major Pharmaceuticals
EDRY,EuroDry Ltd. Common Shares ,$27.00,-0.54,-1.961%,62225010.00,Greece,,19459,Consumer Services,Marine Transportation
EDSA,Edesa Biotech Inc. Common Shares,$5.28,-0.10,-1.859%,69989352.00,United States,,11289,,
EDTK,Skillful Craftsman Education Technology Limited Ordinary Share,$2.08,0.02,0.971%,24960000.00,China,2020,201021,Consumer Services,Other Consumer Services
EDTX,EdtechX Holdings Acquisition Corp. II Class A common stock,$9.95,0.00,0.00%,78667188.00,United Kingdom,2021,24,,
EDTXW,EdtechX Holdings Acquisition Corp. II Warrant,$0.5901,-0.05,-7.811%,0.00,United Kingdom,2021,20823,,
EDUC,Educational Development Corporation Common Stock,$12.70,-0.08,-0.626%,106057344.00,United States,,17807,Consumer Durables,Consumer Specialties
EEFT,Euronet Worldwide Inc. Common Stock,$136.354,-2.966,-2.129%,7199130407.00,United States,1997,48710,Technology,EDP Services
EEIQ,Elite Education Group International Ltd. Common Stock,$4.73,-0.22,-4.444%,41094240.00,United States,2021,60879,Consumer Services,Other Consumer Services
EFOI,Energy Focus Inc. Common Stock,$4.43,0.01,0.226%,22457845.00,United States,,1096231,Consumer Durables,Building Products
EFSC,Enterprise Financial Services Corporation Common Stock,$45.2601,-1.1599,-2.499%,1414258910.00,United States,,62448,Finance,Major Banks
EGAN,eGain Corporation Common Stock,$11.39,-0.02,-0.175%,354217826.00,United States,1999,83754,Technology,Computer Software: Prepackaged Software
EGBN,Eagle Bancorp Inc. Common Stock,$55.69,-1.58,-2.759%,1779981267.00,United States,,33509,Finance,Major Banks
EGLE,Eagle Bulk Shipping Inc. Common Stock,$43.53,-1.83,-4.034%,546434092.00,United States,,240407,Transportation,Marine Transportation
EGLX,Enthusiast Gaming Holdings Inc. Common Stock,$5.81,-0.48,-7.631%,729494635.00,Canada,,490868,,
EGRX,Eagle Pharmaceuticals Inc. Common Stock,$44.25,0.01,0.023%,580515086.00,United States,2014,35152,Health Care,Major Pharmaceuticals
EH,EHang Holdings Limited ADS,$37.895,-2.575,-6.363%,2100483206.00,China,2019,1417262,Transportation,Air Freight/Delivery Services
EHTH,eHealth Inc. Common Stock,$56.64,-1.36,-2.345%,1480342644.00,United States,2006,197882,Finance,Specialty Insurers
EIGR,Eiger BioPharmaceuticals Inc. Common Stock,$8.645,0.215,2.55%,293509110.00,United States,2014,103890,Health Care,Biotechnology: Biological Products (No Diagnostic Substances)
EJFA,EJF Acquisition Corp. Class A Ordinary Share,$9.66,0.01,0.104%,347156250.00,United States,2021,892,Finance,Business Services
EJFAU,EJF Acquisition Corp. Unit,$9.94,0.01,0.101%,0.00,United States,2021,500,Finance,Business Services
EJFAW,EJF Acquisition Corp. Warrant,$0.7903,-0.0097,-1.213%,0.00,United States,2021,46709,,
EJH,E-Home Household Service Holdings Limited Ordinary Shares,$26.2264,-0.2436,-0.92%,880041434.00,China,2021,64006,Consumer Services,Other Consumer Services
EKSO,Ekso Bionics Holdings Inc. Common Stock,$5.27,-0.26,-4.702%,66691818.00,United States,,47783,Capital Goods,Industrial Machinery/Components
ELDN,Eledon Pharmaceuticals Inc. Common Stock,$7.50,-0.08,-1.055%,107299605.00,United States,2014,4740,Health Care,Major Pharmaceuticals
ELEV,Elevation Oncology Inc. Common stock,$15.29,-0.04,-0.261%,348951897.00,United States,2021,91290,,
ELMS,Electric Last Mile Solutions Inc. Class A Common stock,$10.08,-0.38,-3.633%,322471800.00,United States,2021,236843,Capital Goods,Auto Manufacturing
ELMSW,Electric Last Mile Solutions Inc. Warrant,$2.30,-0.06,-2.542%,0.00,United States,2020,21850,Capital Goods,Auto Manufacturing
ELOX,Eloxx Pharmaceuticals Inc. Common Stock,$1.8729,-0.0671,-3.459%,161424485.00,United States,,747369,Health Care,Major Pharmaceuticals
ELSE,Electro-Sensors Inc. Common Stock,$5.1362,-0.1138,-2.168%,17440075.00,United States,,88499,Capital Goods,Industrial Machinery/Components
ELTK,Eltek Ltd. Ordinary Shares,$6.7016,0.1816,2.785%,29354804.00,Israel,1997,219343,Technology,Electrical Products
ELYS,Elys Game Technology Corp. Common Stock,$3.9912,-0.0588,-1.452%,66513743.00,Canada,,103775,Consumer Services,Movies/Entertainment
EM,Smart Share Global Limited American Depositary Shares,$5.74,-0.09,-1.544%,1431763059.00,China,2021,64918,Consumer Services,Other Consumer Services
EMCF,Emclaire Financial Corp Common Stock,$30.0602,0.00,0.00%,81800177.00,United States,,6,Finance,Major Banks
EMKR,EMCORE Corporation Common Stock,$9.38,0.05,0.536%,345541181.00,United States,1997,224494,Technology,Semiconductors
EML,Eastern Company (The) Common Stock,$30.995,0.215,0.699%,193827263.00,United States,,14328,Capital Goods,Industrial Specialties
ENDP,Endo International plc Ordinary Shares,$4.41,0.11,2.558%,1028876488.00,Ireland,,1385792,Health Care,Major Pharmaceuticals
ENFA,890 5th Avenue Partners Inc. Class A Common Stock,$9.86,-0.01,-0.101%,354343750.00,United States,2021,8245,,
ENFAU,890 5th Avenue Partners Inc. Unit,$10.26,-0.03,-0.292%,0.00,United States,2021,3243,,
ENFAW,890 5th Avenue Partners Inc. Warrant,$1.33,0.05,3.906%,0.00,United States,2021,2804,Finance,Business Services
ENG,ENGlobal Corporation Common Stock,$2.93,-0.30,-9.288%,102936133.00,United States,,2122494,Consumer Services,Military/Government/Technical
ENLV,Enlivex Therapeutics Ltd. Ordinary Shares,$8.68,-0.22,-2.472%,116865532.00,Israel,2014,33693,Health Care,Major Pharmaceuticals
ENNV,ECP Environmental Growth Opportunities Corp. Class A Common Stock,$9.77,0.04,0.411%,421331250.00,United States,2021,140,,
ENNVU,ECP Environmental Growth Opportunities Corp. Unit,$10.09,0.00,0.00%,0.00,United States,2021,2,,
ENNVW,ECP Environmental Growth Opportunities Corp. Warrants,$1.4508,-0.0192,-1.306%,0.00,United States,2021,832,Finance,Business Services
ENOB,Enochian Biosciences Inc. Common Stock,$4.8101,-0.1299,-2.63%,249893863.00,United States,,240027,Health Care,Major Pharmaceuticals
ENPH,Enphase Energy Inc. Common Stock,$185.1373,-1.2727,-0.683%,25122925922.00,United States,2012,1140829,Capital Goods,Electrical Products
ENSC,Ensysce Biosciences Inc. Common Stock,$15.00,0.50,3.448%,93364020.00,United States,,1000,,
ENSG,The Ensign Group Inc. Common Stock,$86.63,-2.00,-2.257%,4762698486.00,United States,2007,69049,Health Care,Hospital/Nursing Management
ENTA,Enanta Pharmaceuticals Inc. Common Stock,$43.61,-0.59,-1.335%,880709576.00,United States,2013,31714,Health Care,Biotechnology: In Vitro & In Vivo Diagnostic Substances
ENTG,Entegris Inc. Common Stock,$115.92,-2.66,-2.243%,15707274993.00,United States,2000,307484,Technology,Semiconductors
ENTX,Entera Bio Ltd. Ordinary Shares,$5.885,-0.315,-5.081%,107308214.00,Israel,2018,427843,Health Care,Biotechnology: Biological Products (No Diagnostic Substances)
ENTXW,Entera Bio Ltd. Warrant,$1.05,-0.20,-16.00%,0.00,Israel,2018,20558,Health Care,Biotechnology: Biological Products (No Diagnostic Substances)
ENVB,Enveric Biosciences Inc. Common Stock,$2.21,0.02,0.913%,47272541.00,United States,,366227,Health Care,Major Pharmaceuticals
ENVI,Environmental Impact Acquisition Corp. Class A Common Stock,$9.79,-0.05,-0.508%,253316250.00,United States,2021,194,,
ENVIU,Environmental Impact Acquisition Corp. Unit,$10.38,0.00,0.00%,0.00,United States,2021,2,,
ENVIW,Environmental Impact Acquisition Corp. Warrant,$1.08,-0.03,-2.703%,0.00,United States,2021,3055,Finance,Business Services
EOLS,Evolus Inc. Common Stock,$12.6601,-0.1299,-1.016%,685168562.00,United States,2018,101191,Consumer Durables,Specialty Chemicals
EOSE,Eos Energy Enterprises Inc. Class A Common Stock,$17.22,-0.40,-2.27%,892017818.00,United States,,165441,Technology,Electronic Components
EOSEW,Eos Energy Enterprises Inc. Warrant,$6.97,-0.10,-1.414%,0.00,United States,,4672,Technology,Electronic Components
EPAY,Bottomline Technologies Inc. Common Stock,$37.38,0.00,0.00%,1696597422.00,United States,1999,87109,Technology,EDP Services
EPHY,Epiphany Technology Acquisition Corp. Class A Common Stock,$9.73,0.00,0.00%,497324625.00,United States,2021,4481,,
EPHYU,Epiphany Technology Acquisition Corp. Unit,$10.0897,0.0197,0.196%,0.00,United States,2021,1661,,
EPHYW,Epiphany Technology Acquisition Corp. Warrant,$1.14,0.04,3.636%,0.00,United States,2021,21366,Finance,Business Services
EPIX,ESSA Pharma Inc. Common Stock,$26.65,-1.63,-5.764%,773076818.00,Canada,,36204,,
EPSN,Epsilon Energy Ltd. Common Share,$5.09,0.04,0.792%,121131739.00,United States,,38587,Energy,Oil & Gas Production
EPZM,Epizyme Inc. Common Stock,$7.68,-0.28,-3.518%,783172639.00,United States,2013,502202,Health Care,Major Pharmaceuticals
EQ,Equillium Inc. Common Stock,$5.69,-0.06,-1.043%,165239136.00,United States,2018,41437,Health Care,Major Pharmaceuticals
EQBK,Equity Bancshares Inc. Class A Common Stock,$29.64,-1.06,-3.453%,424878344.00,United States,2015,8750,Finance,Finance: Consumer Services
EQIX,Equinix Inc. Common Stock REIT,$816.90,16.40,2.049%,73177825211.00,United States,2000,103369,Consumer Services,Real Estate Investment Trusts
EQOS,Diginex Limited Ordinary Shares,$6.16,0.20,3.356%,239579944.00,Singapore,2019,164761,Miscellaneous,Business Services
ERES,East Resources Acquisition Company Class A Common Stock,$9.80,-0.0129,-0.131%,422625000.00,United States,2020,2807,,
ERESU,East Resources Acquisition Company Unit,$10.2837,0.1372,1.352%,0.00,United States,2020,2030,,
ERESW,East Resources Acquisition Company Warrant,$1.05,0.01,0.962%,0.00,United States,2020,11954,Finance,Business Services
ERIC,Ericsson American Depositary Shares,$12.85,0.01,0.078%,42843849795.00,Sweden,,2859749,Technology,Computer Software: Prepackaged Software
ERIE,Erie Indemnity Company Class A Common Stock,$188.92,-3.19,-1.661%,9878601863.00,United States,,9079,Finance,Specialty Insurers
ERII,Energy Recovery Inc. Common Stock,$21.79,0.09,0.415%,1253418129.00,United States,2008,188949,Technology,Industrial Machinery/Components
ERYP,Erytech Pharma S.A. American Depositary Shares,$4.8999,-0.0901,-1.806%,127621448.00,France,2017,16640,Health Care,Biotechnology: Biological Products (No Diagnostic Substances)
ESBK,Elmira Savings Bank Elmira NY Common Stock,$14.4291,0.1291,0.903%,50677972.00,United States,,1005,Finance,Major Banks
ESCA,Escalade Incorporated Common Stock,$22.70,-0.29,-1.261%,315613127.00,United States,,6668,Consumer Non-Durables,Recreational Products/Toys
ESEA,Euroseas Ltd. Common Stock (Marshall Islands),$21.75,-0.57,-2.554%,121805633.00,Greece,,78217,Transportation,Marine Transportation
ESGR,Enstar Group Limited Ordinary Shares,$234.66,-3.89,-1.631%,5208717514.00,Bermuda,,16917,Finance,Property-Casualty Insurers
ESGRO,Enstar Group Limited Depository Shares 7.00% Perpetual Non-Cumulative Preference Shares Series E,$27.96,0.00,0.00%,0.00,Bermuda,,226,Finance,Property-Casualty Insurers
ESGRP,Enstar Group Limited Depositary Shares Each Representing 1/1000th of an interest in Preference Shares,$29.56,0.11,0.374%,0.00,Bermuda,,1224,Finance,Property-Casualty Insurers
ESLT,Elbit Systems Ltd. Ordinary Shares,$126.51,-2.09,-1.625%,5591762748.00,Israel,,7818,Capital Goods,Military/Government/Technical
ESPR,Esperion Therapeutics Inc. Common Stock,$20.395,-0.095,-0.464%,574978573.00,United States,2013,308443,Health Care,Major Pharmaceuticals
ESQ,Esquire Financial Holdings Inc. Common Stock,$23.63,-0.18,-0.756%,185018528.00,United States,2017,5621,Finance,Commercial Banks
ESSA,ESSA Bancorp Inc. Common Stock,$16.10,-0.18,-1.106%,171745156.00,United States,,26407,Finance,Banks
ESSC,East Stone Acquisition Corporation Ordinary Shares,$10.10,0.00,0.00%,178805350.00,United States,2020,20681,Finance,Business Services
ESSCR,East Stone Acquisition Corporation Right,$0.3899,0.0003,0.077%,0.00,United States,2020,19026,Technology,Computer Software: Programming Data Processing
ESSCU,East Stone Acquisition Corporation Unit,$10.50,0.00,0.00%,0.00,United States,2020,5100,Finance,Business Services
ESSCW,East Stone Acquisition Corporation Warrant,$0.2719,0.0019,0.704%,0.00,United States,2020,4350,Technology,Computer Software: Programming Data Processing
ESTA,Establishment Labs Holdings Inc. Common Shares,$81.725,-4.135,-4.816%,1935886109.00,Costa Rica,2018,36216,Health Care,Industrial Specialties
ESXB,Community Bankers Trust Corporation Common Stock (VA),$11.01,-0.34,-2.996%,246843385.00,United States,,64172,Finance,Major Banks
ETAC,E.Merge Technology Acquisition Corp. Class A Common Stock,$9.76,0.01,0.103%,743712000.00,United States,2020,13696,,
ETACU,E.Merge Technology Acquisition Corp. Unit,$10.05,-0.08,-0.79%,0.00,United States,2020,500,,
ETACW,E.Merge Technology Acquisition Corp. Warrant,$0.99,0.03,3.125%,0.00,United States,2020,56467,,
ETNB,89bio Inc. Common Stock,$17.22,-0.22,-1.261%,345437815.00,United States,2019,63883,Health Care,Major Pharmaceuticals
ETON,Eton Pharmaceuticals Inc. Common Stock,$5.6983,-0.3117,-5.186%,139651748.00,United States,2018,336803,Health Care,Major Pharmaceuticals
ETSY,Etsy Inc. Common Stock,$195.90,-1.67,-0.845%,24899398948.00,United States,2015,1278392,Consumer Services,Catalog/Specialty Distribution
ETTX,Entasis Therapeutics Holdings Inc. Common Stock,$2.67,-0.08,-2.909%,126318378.00,United States,2018,38230,Health Care,Major Pharmaceuticals
EUCR,Eucrates Biomedical Acquisition Corp. Ordinary Shares,$9.93,0.00,0.00%,133649101.00,United States,2020,28,Finance,Business Services
EUCRW,Eucrates Biomedical Acquisition Corp. Warrant,$0.9299,-0.0402,-4.144%,0.00,United States,2020,2051,Finance,Business Services
EUSG,European Sustainable Growth Acquisition Corp. Class A Ordinary Shares,$9.69,0.00,0.00%,174698588.00,United States,2021,3,Finance,Business Services
EUSGU,European Sustainable Growth Acquisition Corp. Unit,$10.16,-0.05,-0.49%,0.00,United States,2021,151,Finance,Business Services
EUSGW,European Sustainable Growth Acquisition Corp. Warrant,$1.07,0.00,0.00%,0.00,United States,2021,30606,Finance,Business Services
EVAX,Evaxion Biotech A/S American Depositary Share,$7.20,-0.11,-1.505%,138230410.00,Denmark,2021,30750,Health Care,Biotechnology: Biological Products (No Diagnostic Substances)
EVBG,Everbridge Inc. Common Stock,$141.10,3.32,2.41%,5384723812.00,United States,2016,149165,Technology,Computer Software: Prepackaged Software
EVCM,EverCommerce Inc. Common Stock,$18.18,0.94,5.452%,0.00,United States,2021,499298,,
EVER,EverQuote Inc. Class A Common Stock,$31.55,-0.45,-1.406%,907823234.00,United States,2018,46557,Technology,EDP Services
EVFM,Evofem Biosciences Inc. Common Stock,$1.01,-0.05,-4.717%,82093089.00,United States,2014,4284376,Health Care,Major Pharmaceuticals
EVGN,Evogene Ltd Ordinary Shares,$3.31,0.04,1.223%,134455920.00,Israel,,351275,Basic Industries,Agricultural Chemicals
EVGO,EVgo Inc. Class A Common Stock,$14.4801,-0.6199,-4.105%,416302875.00,United States,,1257421,Consumer Services,Automotive Aftermarket
EVGOW,EVgo Inc. Warrants,$4.27,-0.13,-2.955%,0.00,United States,,223405,,
EVK,Ever-Glory International Group Inc. Common Stock,$2.75,-0.10,-3.509%,40729315.00,China,,626093,Consumer Non-Durables,Apparel
EVLMC,Eaton Vance NextShares Trust II Eaton Vance TABS 5-to-15 Year Laddered Municipal Bond NextShares,$99.96,0.00,0.00%,0.00,United States,,14,Finance,Investment Managers
EVLO,Evelo Biosciences Inc. Common Stock,$12.90,-0.04,-0.309%,688523078.00,United States,2018,262577,Consumer Durables,Specialty Chemicals
EVOJ,Evo Acquisition Corp. Class A Common Stock,$9.70,0.00,0.00%,151568563.00,United States,2021,54,,
EVOJU,Evo Acquisition Corp. Unit,$10.07,0.00,0.00%,0.00,United States,2021,7,,
EVOJW,Evo Acquisition Corp. Warrant,$0.6501,0.0001,0.015%,0.00,United States,2021,3900,Finance,Business Services
EVOK,Evoke Pharma Inc. Common Stock,$1.25,-0.06,-4.58%,40464943.00,United States,2013,64221,Health Care,Major Pharmaceuticals
EVOL,Evolving Systems Inc. Common Stock,$2.23,-0.01,-0.446%,27265267.00,United States,1998,90086,Technology,EDP Services
EVOP,EVO Payments Inc. Class A Common Stock,$28.55,-0.37,-1.279%,1184090494.00,United States,2018,46386,Miscellaneous,Business Services
EWBC,East West Bancorp Inc. Common Stock,$69.58,-2.89,-3.988%,9870855302.00,United States,,322099,Finance,Commercial Banks
EWTX,Edgewise Therapeutics Inc. Common Stock,$21.39,0.98,4.802%,1053549712.00,United States,2021,65112,Health Care,Major Pharmaceuticals
EXAS,Exact Sciences Corporation Common Stock,$119.81,-3.01,-2.451%,20553483377.00,United States,2001,683172,Health Care,Biotechnology: Commercial Physical & Biological Resarch
EXC,Exelon Corporation Common Stock,$44.63,-0.50,-1.108%,43611330738.00,United States,,1022592,Public Utilities,Power Generation
EXEL,Exelixis Inc. Common Stock,$18.50,0.24,1.314%,5797663293.00,United States,2000,958658,Health Care,Biotechnology: Commercial Physical & Biological Resarch
EXFO,EXFO Inc,$5.92,-0.04,-0.671%,339378030.00,Canada,,81346,Capital Goods,Electrical Products
EXLS,ExlService Holdings Inc. Common Stock,$105.29,-1.33,-1.247%,3522756600.00,United States,2006,18910,Technology,Retail: Computer Software & Peripheral Equipment
EXPD,Expeditors International of Washington Inc. Common Stock,$126.8399,-1.1601,-0.906%,21421459505.00,United States,,259119,Transportation,Oil Refining/Marketing
EXPE,Expedia Group Inc. Common Stock,$165.15,-2.27,-1.356%,24272195911.00,United States,,759799,Transportation,Other Consumer Services
EXPI,eXp World Holdings Inc. Common Stock,$38.49,0.41,1.077%,5572480740.00,United States,,401823,Finance,Real Estate
EXPO,Exponent Inc. Common Stock,$89.69,-1.08,-1.19%,4674901018.00,United States,,53256,Consumer Services,Professional Services
EXTR,Extreme Networks Inc. Common Stock,$10.73,-0.48,-4.282%,1352619218.00,United States,1999,315807,Capital Goods,Telecommunications Equipment
EYE,National Vision Holdings Inc. Common Stock,$49.26,-1.52,-2.993%,4010944959.00,United States,2017,104652,Health Care,Ophthalmic Goods
EYEG,Eyegate Pharmaceuticals Inc. Common Stock,$3.60,-0.03,-0.826%,25552483.00,United States,,23169,Health Care,Major Pharmaceuticals
EYEN,Eyenovia Inc. Common Stock,$4.8949,-0.1051,-2.102%,126560572.00,United States,2018,16160,Health Care,Major Pharmaceuticals
EYES,Second Sight Medical Products Inc. Common Stock,$4.47,0.00,0.00%,176158896.00,United States,2014,4979543,Health Care,Biotechnology: Electromedical & Electrotherapeutic Apparatus
EYESW,Second Sight Medical Products Inc. Warrants expiring 03/14/2024,$1.20,0.035,3.004%,0.00,United States,,1036,Health Care,Industrial Specialties
EYPT,EyePoint Pharmaceuticals Inc. Common Stock,$8.45,-0.37,-4.195%,242865464.00,United States,,112970,Health Care,Major Pharmaceuticals
EZGO,EZGO Technologies Ltd. Ordinary Shares,$3.705,-0.265,-6.675%,49656640.00,China,2021,411043,Consumer Non-Durables,Motor Vehicles
EZPW,EZCORP Inc. Class A Non Voting Common Stock,$6.01,0.03,0.502%,336900274.00,United States,1991,133922,Miscellaneous,Diversified Commercial Services
FA,First Advantage Corporation Common Stock,$19.1421,-0.8579,-4.29%,2925989623.00,United States,2021,177205,Technology,Internet and Information Services
FAMI,Farmmi Inc. Ordinary Shares,$0.4309,-0.0195,-4.329%,8841078.00,China,2018,5433088,Consumer Non-Durables,Packaged Foods
FANG,Diamondback Energy Inc. Commmon Stock,$91.99,-6.07,-6.19%,16649947882.00,United States,2012,1767119,Energy,Oil & Gas Production
